,artist,screen_name,hotttnesss,num_tweets,recommendations,scores
0,Arcade Fire,arcadefire,0.959746,200,"[u'Arcade Fire', u'System of a Down', u'Vampire Weekend', u'The Strypes', u'Eminem']",[   0.          147.86480311  148.76827619  149.69635934  150.09663554]
1,Eminem,Eminem,0.945441,200,"[u'Eminem', u'Maya Jane Coles', u'John Legend', u'Avicii', u'The Strypes']",[   0.          129.03875387  129.20139318  138.03984932  138.10865288]
2,Lorde,lordemusic,0.942642,200,"[u'Lorde', u'Sia', u'Girls', u'Alex Clare', u'Krewella']",[  0.          85.46929273  85.72630868  88.0113629   91.7986928 ]
3,Avicii,Avicii,0.940199,200,"[u'Avicii', u'John Legend', u'Katie Melua', u'Maya Jane Coles', u'Sara Bareilles']",[   0.          111.76761606  120.69382751  121.88519188  122.04917042]
4,Lady Gaga,ladygaga,0.926316,200,"[u'Lady Gaga', u'Katie Melua', u'Harry Connick, Jr.', u'Ed Sheeran', u'Metronomy']",[   0.          120.76837334  125.1519077   131.91664035  133.26664999]
5,Imagine Dragons,Imaginedragons,0.905983,198,"[u'Imagine Dragons', u'Active Child', u'OneRepublic', u'Guy Sebastian', u'Sara Bareilles']",[   0.          122.05326706  126.73989112  126.90941651  127.74192734]
6,Lana Del Rey,LanaDelRey,0.905385,200,"[u'Lana Del Rey', u'Flume', u'Inna', u'Ricky Martin', u'JoJo']",[  0.          90.98901033  93.1020945   95.94269123  96.76259608]
7,Robin Thicke,robinthicke,0.900195,200,"[u'Robin Thicke', u'Carly Rae Jepsen', u'Jason Mraz', u'Daughtry', u'John Legend']",[   0.          121.02479085  122.84543134  126.11502686  126.50296439]
8,One Direction,onedirection,0.89952,200,"[u'One Direction', u'Train', u'A.R. Rahman', u'Jason Mraz', u'Asking Alexandria']",[   0.          199.40912717  200.51683221  202.76834072  208.30506475]
9,Britney Spears,britneyspears,0.898823,200,"[u'Britney Spears', u'will.i.am', u'Ariana Grande', u'Guy Sebastian', u'Eliza Doolittle']",[   0.          130.18832513  134.16407865  135.52490546  136.1800279 ]
10,Bruno Mars,BrunoMars,0.898684,200,"[u'Bruno Mars', u'Gabrielle Aplin', u'MGMT', u'Emeli Sande', u'Marina and The Diamonds']",[   0.           95.00526301   97.44229061   98.46319109  104.00961494]
11,OneRepublic,OneRepublic,0.895344,200,"[u'OneRepublic', u'All Time Low', u'Guy Sebastian', u'Ms Mr', u'Goldfrapp']",[   0.          109.21996155  110.64809081  114.32847414  114.49890829]
12,Justin Timberlake,jtimberlake,0.894973,200,"[u'Justin Timberlake', u'Jason Mraz', u'Mariah Carey', u'John Legend', u'David Guetta']",[   0.          152.76452468  156.63652192  158.55913723  159.32357013]
13,Arctic Monkeys,ArcticMonkeys,0.893465,200,"[u'Arctic Monkeys', u'The Cranberries', u'Marilyn Manson', u'fun.', u'Editors']",[   0.          140.89357686  154.37292509  158.12336956  158.42032698]
14,Rihanna,rihanna,0.892717,200,"[u'Rihanna', u'Lana Del Rey', u'Flume', u'Iggy Azalea', u'JoJo']",[   0.          103.46980236  105.83477689  106.92988357  109.97727038]
15,Jason Derülo,jasonderulo,0.891253,200,"[u'Jason Der\xfclo', u'Chris Brown', u'Iggy Azalea', u'Mariah Carey', u'Demi Lovato']",[   0.          149.73643511  150.94701057  152.71542162  153.91556127]
16,Calvin Harris,CalvinHarris,0.885646,200,"[u'Calvin Harris', u'Flume', u'Lana Del Rey', u'Iggy Azalea', u'JoJo']",[   0.          115.39497389  120.12909722  120.43670537  123.03657993]
17,Martin Garrix,MartinGarrix,0.882746,200,"[u'Martin Garrix', u'Steve Angello', u'Skrillex', u'Duke Dumont', u'Krewella']",[  0.          87.51571287  88.07950954  90.28842672  90.56489386]
18,Passenger,passengermusic,0.882349,200,"[u'Passenger', u'Krewella', u'Martin Garrix', u'Duke Dumont', u'Gabrielle Aplin']",[  0.          90.55937279  91.17565465  94.05849244  96.34313676]
19,Justin Bieber,justinbieber,0.881963,200,"[u'Justin Bieber', u'All Time Low', u'Metronomy', u'will.i.am', u'Guy Sebastian']",[   0.          130.10764774  134.11934983  136.16901263  139.06113763]
20,Capital Cities,capitalcities,0.881834,200,"[u'Capital Cities', u'Fitz & The Tantrums', u'Marina and The Diamonds', u'Flume', u'Vampire Weekend']",[   0.          121.73331508  141.23384863  141.32586458  143.1886867 ]
21,John Newman,JohnNewmanMusic,0.880855,200,"[u'John Newman', u'Guy Sebastian', u'Craig Campbell', u'All Time Low', u'Lucy Rose']",[   0.          107.26602444  107.58252646  109.45318634  112.04463396]
22,Pitbull,Pitbull,0.875944,200,"[u'Pitbull', u'Lucy Spraggan', u'All Time Low', u'Eliza Doolittle', u'Ed Sheeran']",[   0.          163.13184852  164.09753197  165.22711642  167.08680379]
23,P!nk,Pink,0.874734,199,"[u'P!nk', u'Carrie Underwood', u'Ariana Grande', u'Sara Bareilles', u'All Time Low']",[   0.          140.15348729  141.77446879  143.7463043   145.4957044 ]
24,Bastille,BASTILLEdan,0.868897,200,"[u'Bastille', u'Guy Sebastian', u'Goldfrapp', u'All Time Low', u'Chase & Status']",[   0.          110.96846399  116.94870671  119.04620952  122.03278248]
25,Avril Lavigne,AvrilLavigne,0.867785,200,"[u'Avril Lavigne', u'Thomas Rhett', u'Robin Thicke', u'Avicii', u'Ne-Yo']",[   0.          151.61134522  160.78557149  169.80871591  172.27884374]
26,David Guetta,davidguetta,0.866272,200,"[u'David Guetta', u'Jason Mraz', u'Ne-Yo', u'Mariah Carey', u'Carly Rae Jepsen']",[   0.          112.71645843  116.22392181  122.51122398  122.69881825]
27,James Arthur,JamesArthur23,0.865246,200,"[u'James Arthur', u'Lorde', u'will.i.am', u'David Nail', u'Sean Kingston']",[   0.          199.939991    205.39717622  207.57890066  208.38426044]
28,Selena Gomez,selenagomez,0.864422,200,"[u'Selena Gomez', u'Trina', u'Lykke Li', u'Akon', u'Tame Impala']",[   0.           70.24243732   78.33900689   93.8349615   102.92230079]
29,Icona Pop,iconapop,0.861703,200,"[u'Icona Pop', u'Bloc Party', u'Rise Against', u'Lana Del Rey', u'Lykke Li']",[   0.          207.17866686  208.92343095  209.69740103  209.81420352]
30,Naughty Boy,NaughtyBoyMusic,0.858578,200,"[u'Naughty Boy', u'will.i.am', u'David Nail', u'Foster the People', u'John Newman']",[   0.          168.52299546  169.41959745  170.09997061  171.06139249]
31,Adele,OfficialAdele,0.857546,191,"[u'Adele', u'Agnes Obel', u'System of a Down', u'AFI', u'Gorillaz']",[   0.          197.850954    200.86811594  201.09947787  201.11439531]
32,Paul McCartney,PaulMcCartney,0.856852,200,"[u'Paul McCartney', u'Jason Mraz', u'The Strypes', u'Dixie Chicks', u'Mumford and Sons']",[   0.          203.86024625  208.92582416  209.22953902  209.79990467]
33,Zedd,Zedd,0.855864,200,"[u'Zedd', u'Nicky Romero', u'Marina and The Diamonds', u'Dillon Francis', u'MGMT']",[   0.          110.46266338  115.68491691  116.40876256  117.67752547]
34,Birdy,OfficialBirdy,0.852087,199,"[u'Birdy', u'Sara Bareilles', u'Tori Kelly', u'Goldfrapp', u'Christina Perri']",[   0.          118.91173197  123.5435146   124.64750298  126.09520213]
35,Haim,HAIMtheband,0.850693,199,"[u'Haim', u'Bloc Party', u'The Kooks', u'Rihanna', u'Kodaline']",[   0.          132.66876045  135.67977005  140.83678497  141.27278577]
36,Linkin Park,linkinpark,0.84884,200,"[u'Linkin Park', u'Bon Iver', u'Nine Inch Nails', u'fun.', u'Mayday Parade']",[   0.          172.12785945  174.73122217  176.7116295   179.11728002]
37,Lou Reed,LouReed,0.847814,200,"[u'Lou Reed', u'Massive Attack', u'Tame Impala', u'Selena Gomez', u'Korpiklaani']",[   0.           97.34988444  125.18785884  134.24231822  140.13564857]
38,Maroon 5,maroon5,0.847207,200,"[u'Maroon 5', u'Halestorm', u'Kings of Leon', u'Mumford and Sons', u'Bon Iver']",[   0.          154.29517167  158.93709447  161.20794025  161.57041808]
39,Armin van Buuren,arminvanbuuren,0.845704,200,"[u'Armin van Buuren', u'MGMT', u'Guy Sebastian', u'Martin Garrix', u'Emeli Sande']",[   0.           98.72689603  103.28601067  104.41743149  104.97142468]
40,Marc Anthony,MarcAnthony,0.8448,200,"[u'Marc Anthony', u'Ricky Martin', u'Shakira', u'Noel Torres', u'Inna']",[   0.          206.5357112   211.57031928  217.16583525  218.7921388 ]
41,Demi Lovato,ddlovato,0.843741,199,"[u'Demi Lovato', u'Sara Bareilles', u'Mary J. Blige', u'Mariah Carey', u'Daughtry']",[   0.          124.06449935  128.92245731  129.34450124  129.73819792]
42,Coldplay,coldplay,0.842819,199,"[u'Coldplay', u'John Legend', u'Jason Mraz', u'Guy Sebastian', u'Metronomy']",[   0.          118.44830096  123.38557452  123.55565548  124.56323695]
43,Paramore,paramore,0.841467,199,"[u'Paramore', u'Goo Goo Dolls', u'Mumford and Sons', u'fun.', u'Kings of Leon']",[   0.          185.82249595  192.04686928  192.24463582  194.23954283]
44,Olly Murs,ollyofficial,0.84138,200,"[u'Olly Murs', u'Katie Melua', u'John Legend', u'Tom Odell', u'Guy Sebastian']",[   0.          132.39335331  136.34881738  137.78606606  140.53113534]
45,AWOLNATION,awolnation,0.840083,199,"[u'AWOLNATION', u'Demi Lovato', u'Zendaya', u'Justin Bieber', u'Foxes']",[   0.          193.41923379  194.2832983   195.42006038  197.47404893]
46,Flo Rida,official_flo,0.839649,199,"[u'Flo Rida', u'Nicki Minaj', u'Chris Brown', u'Demi Lovato', u'Rick Ross']",[   0.          211.93867037  214.05373157  219.57686581  222.12383933]
47,Kings of Leon,KingsOfLeon,0.839169,181,"[u'Kings of Leon', u'Mumford and Sons', u'Bon Iver', u'The Cranberries', u'fun.']",[   0.          127.10232099  141.93660557  144.18391034  144.59944675]
48,G-Dragon,IBGDRGN,0.838516,200,"[u'G-Dragon', u'Lana Del Rey', u'\u304d\u3083\u308a\u30fc\u3071\u307f\u3085\u3071\u307f\u3085', u'Flume', u'Chris Brown']",[   0.          173.42721816  180.26646943  181.54889149  182.64993841]
49,The Lumineers,thelumineers,0.836348,200,"[u'The Lumineers', u'Bon Iver', u'fun.', u'Rise Against', u'You Me At Six']",[   0.          135.76818479  136.60893089  141.97887167  145.85609346]
50,Chris Brown,chrisbrown,0.835919,200,"[u'Chris Brown', u'Lana Del Rey', u'Rihanna', u'The Kooks', u'Big Sean']",[   0.          118.00847427  118.6338906   119.39849245  120.82632164]
51,will.i.am,iamwill,0.834285,200,"[u'will.i.am', u'All Time Low', u'Metronomy', u'Guy Sebastian', u'Lorde']",[   0.          114.          118.81919037  120.73110618  122.35195135]
52,CHVRCHES,CHVRCHES,0.833085,199,"[u'CHVRCHES', u'The Strypes', u'Kodaline', u'Crystal Fighters', u'Bloc Party']",[   0.          123.00406497  123.73762564  123.83052935  126.45157176]
53,Metallica,Metallica,0.832087,199,"[u'Metallica', u'Metronomy', u'All Time Low', u'Gramatik', u'Moby']",[   0.          176.00568173  176.91240771  180.20266369  182.00549442]
54,Jessie J,JessieJ,0.828534,200,"[u'Jessie J', u'Selena Gomez', u'Lykke Li', u'Trina', u'Akon']",[   0.          127.2202814   134.67739231  139.29465173  143.08738589]
55,Sean Paul,duttypaul,0.828472,198,"[u'Sean Paul', u'Sky Ferreira', u'Marina and The Diamonds', u'Kendrick Lamar', u'Wiz Khalifa']",[   0.          253.79913317  258.25762331  260.69138843  261.02490303]
56,Fall Out Boy,falloutboy,0.828321,199,"[u'Fall Out Boy', u'Rise Against', u'Chris Brown', u'Jason Mraz', u'Marilyn Manson']",[   0.          136.55401862  140.73734401  142.07040508  142.28492541]
57,Panic! At the Disco,PanicAtTheDisco,0.827717,199,"[u'Panic! At the Disco', u'Tegan and Sara', u'Halestorm', u'Train', u'Empire of the Sun']",[   0.          216.18741869  218.63668494  218.71671175  221.14474898]
58,John Legend,johnlegend,0.827702,199,"[u'John Legend', u'Tom Odell', u'Avicii', u'Goldfrapp', u'Katie Melua']",[   0.          110.48076756  111.76761606  114.80853627  114.99130402]
59,Jay-Z,S_C_,0.827281,200,"[u'Jay-Z', u'Lorde', u'Foster the People', u'David Nail', u'Kaskade']",[   0.          203.77683872  205.09266198  205.60155641  206.9323561 ]
60,Cher,cher,0.826867,200,"[u'Cher', u'Lorde', u'Girls', u'Boy George', u'Alex Clare']",[   0.          128.03124619  131.06105447  133.48408145  134.36517406]
61,Romeo Santos,RomeoSantosPage,0.824883,199,"[u'Romeo Santos', u'Aventura', u'Lana Del Rey', u'Chris Brown', u'Ricky Martin']",[   0.          154.05518492  227.54559983  231.28986143  231.38279971]
62,The Wanted,thewanted,0.82462,199,"[u'The Wanted', u'Sara Bareilles', u'Daughtry', u'Mary J. Blige', u'Kodaline']",[   0.          167.54402407  171.43220234  171.51676303  172.67020588]
63,Ariana Grande,ArianaGrande,0.824537,200,"[u'Ariana Grande', u'Natalie Grant', u'Cassadee Pope', u'Carrie Underwood', u'Kelly Clarkson']",[   0.          108.59097568  110.78357279  114.15340556  114.94346436]
64,Florida Georgia Line,FLAGALine,0.824472,200,"[u'Florida Georgia Line', u'The Strypes', u'fun.', u'You Me At Six', u'Jason Mraz']",[   0.          149.08386901  151.74320413  152.38110119  153.27426398]
65,Daddy Yankee,daddy_yankee,0.824196,198,"[u'Daddy Yankee', u'Marco Antonio Sol\xeds', u'Dani Mart\xedn', u'Espinoza Paz', u'Reik']",[   0.          248.12093825  251.72206896  252.26771494  255.59733958]
66,Kendrick Lamar,kendricklamar,0.82397,200,"[u'Kendrick Lamar', u'Flume', u'Wiz Khalifa', u'Marina and The Diamonds', u'The Weeknd']",[   0.          117.31581309  118.80235688  119.77061409  121.96720871]
67,Depeche Mode,depechemode,0.82226,200,"[u'Depeche Mode', u'Kings of Leon', u'Mumford and Sons', u'The Strypes', u'M83']",[   0.          178.26945897  178.8490984   191.01047092  191.14654064]
68,The Neighbourhood,thenbhd,0.821299,197,"[u'The Neighbourhood', u'Active Child', u'All Time Low', u'Bastille', u'John Legend']",[   0.          129.34063553  130.43005789  131.4534138   131.96211578]
69,Macklemore,macklemore,0.820942,200,"[u'Macklemore', u'Jason Mraz', u'Mariah Carey', u'Sara Bareilles', u'The Kooks']",[   0.          124.03628501  126.42389015  127.77714976  130.03845585]
70,La Oreja de Van Gogh,laorejadevgogh,0.820514,200,"[u'La Oreja de Van Gogh', u'Reik', u'Dani Mart\xedn', u'Alejandro Sanz', u'Mal\xfa']",[   0.          132.94359706  138.45576911  146.56056768  147.74978849]
71,Blake Shelton,blakeshelton,0.819392,200,"[u'Blake Shelton', u'Cassadee Pope', u'Harry Connick, Jr.', u'Lucy Spraggan', u'Miranda Lambert']",[   0.          143.97221954  148.30711379  149.85326156  150.18987982]
72,Chase & Status,chaseandstatus,0.819305,200,"[u'Chase & Status', u'Guy Sebastian', u'Goldfrapp', u'Feed Me', u'All Time Low']",[   0.          108.75660899  117.18788333  119.80400661  119.9749974 ]
73,The Killers,thekillers,0.81833,198,"[u'The Killers', u'Metronomy', u'The Naked And Famous', u'OneRepublic', u'John Legend']",[   0.          129.23621783  132.26488574  133.43537762  136.1322886 ]
74,Rudimental,RudimentalUk,0.818212,200,"[u'Rudimental', u'CHVRCHES', u'The Kooks', u'Kodaline', u'Crystal Fighters']",[   0.          126.70832648  126.91335627  128.90306435  129.70350805]
75,Michael Jackson,michaeljackson,0.817399,200,"[u'Michael Jackson', u'A.R. Rahman', u'Jason Mraz', u'Madcon', u'Mumford and Sons']",[   0.          191.06543382  194.72031224  200.46446069  200.64645524]
76,Fergie,Fergie,0.817206,200,"[u'Fergie', u'Selena Gomez', u'Trina', u'Ludacris', u'Akon']",[   0.          115.80587204  117.          124.63546847  124.66755793]
77,Iggy Azalea,IGGYAZALEA,0.816537,200,"[u'Iggy Azalea', u'JoJo', u'Marina and The Diamonds', u'Flume', u'Christina Perri']",[  0.          82.77076779  87.37848705  87.50428561  94.29209935]
78,Little Mix,LittleMixOffic,0.815626,200,"[u'Little Mix', u'Metronomy', u'Demi Lovato', u'All Time Low', u'The Naked And Famous']",[   0.          190.96596555  191.48890307  196.16829509  196.36191077]
79,Kelly Clarkson,kelly_clarkson,0.813799,200,"[u'Kelly Clarkson', u'Guy Sebastian', u'Sia', u'Christina Perri', u'MGMT']",[   0.           98.13765842   98.89388252  101.94606417  103.00485425]
80,Keith Urban,KeithUrban,0.812517,199,"[u'Keith Urban', u'Katie Melua', u'Chris Tomlin', u'The Strypes', u'Metric']",[   0.          163.73759495  164.60862675  169.99411755  170.44940598]
81,J. Cole,JColeNC,0.812512,197,"[u'J. Cole', u'Lorde', u'Mac Miller', u'Gabrielle Aplin', u'MGMT']",[   0.          110.18620603  111.12155506  112.74307074  112.8627485 ]
82,Pablo Alboran,pabloalboran,0.811179,198,"[u'Pablo Alboran', u'Dani Mart\xedn', u'Reik', u'Iv\xe1n Ferreiro', u'La Oreja de Van Gogh']",[   0.          190.07630047  195.98724448  196.5858591   199.7173002 ]
83,Alicia Keys,aliciakeys,0.81113,200,"[u'Alicia Keys', u'Ariana Grande', u'Sara Bareilles', u'John Legend', u'Carrie Underwood']",[   0.          151.36049683  152.0098681   156.57266684  156.78328993]
84,The Beatles,thebeatles,0.810456,200,"[u'The Beatles', u'Bob Marley', u'Mumford and Sons', u'Kings of Leon', u'Gotye']",[   0.          169.4933627   177.76670104  181.22361877  186.37596412]
85,The 1975,the1975,0.810444,200,"[u'The 1975', u'Trina', u'Selena Gomez', u'Lykke Li', u'James Blake']",[   0.          102.77159141  108.08330121  124.75175349  130.04614566]
86,Major Lazer,majorlazer,0.809809,200,"[u'Major Lazer', u'Sky Ferreira', u'Marina and The Diamonds', u'Flume', u'Kendrick Lamar']",[   0.          173.61739544  174.33875071  175.56195488  177.07907838]
87,Conor Maynard,ConorMaynard,0.808266,200,"[u'Conor Maynard', u'Metronomy', u'Ariana Grande', u'Sara Bareilles', u'Lucy Spraggan']",[   0.          153.06861207  153.36557632  153.38839591  155.09352017]
88,Big Sean,BigSean,0.806991,200,"[u'Big Sean', u'Rihanna', u'Flume', u'Lana Del Rey', u'Iggy Azalea']",[   0.          113.40634903  114.54256851  117.76671856  118.13974776]
89,Nicki Minaj,NICKIMINAJ,0.806101,200,"[u'Nicki Minaj', u'Chris Brown', u'Meek Mill', u'Zendaya', u'The Kooks']",[   0.          164.31981013  166.52327165  167.31706428  170.50806433]
90,Jason Mraz,jason_mraz,0.806046,200,"[u'Jason Mraz', u'A.R. Rahman', u'David Guetta', u'Mariah Carey', u'Ne-Yo']",[   0.          111.66019882  112.71645843  115.23020437  119.56169955]
91,Mumford and Sons,MumfordAndSons,0.805063,160,"[u'Mumford and Sons', u'Kings of Leon', u'fun.', u'Jason Mraz', u'Bon Iver']",[   0.          127.10232099  129.20526305  130.05767951  136.53937161]
92,Malú,_MaluOficial_,0.804619,200,"[u'Mal\xfa', u'Alejandro Sanz', u'Reik', u'Dani Mart\xedn', u'Noel Torres']",[   0.          142.89856542  144.5129752   144.92756812  147.7294825 ]
93,Swedish House Mafia,swedishousemfia,0.804454,198,"[u'Swedish House Mafia', u'Metric', u'John Legend', u'Kodaline', u'The Neighbourhood']",[   0.          148.17219712  151.77944525  151.81897115  153.15678242]
94,Alejandro Fernández,alexoficial,0.804034,200,"[u'Alejandro Fern\xe1ndez', u'Reik', u'Larry Hernandez', u'Espinoza Paz', u'Vicente Fern\xe1ndez']",[   0.          124.63546847  132.13250925  132.77424449  134.90737563]
95,Tom Odell,tompeterodell,0.803936,200,"[u'Tom Odell', u'Goldfrapp', u'All Time Low', u'Guy Sebastian', u'John Legend']",[   0.          104.27367837  105.01428474  106.48004508  110.48076756]
96,Jason Aldean,Jason_Aldean,0.803855,200,"[u'Jason Aldean', u'Alan Jackson', u'Bon Iver', u'Mumford and Sons', u'Jason Mraz']",[   0.          176.38877515  180.08053754  182.08239893  182.83052262]
97,Guns N' Roses,gunsnroses,0.803601,200,"[u""Guns N' Roses"", u'The Kooks', u'Jason Mraz', u'Mariah Carey', u'Rise Against']",[   0.          140.33174979  143.97916516  144.42298986  145.82523787]
98,Tinie Tempah,TinieTempah,0.802608,200,"[u'Tinie Tempah', u'Flume', u'Iggy Azalea', u'Chris Brown', u'The Kooks']",[   0.          150.96357176  152.02960238  152.77107056  153.41121211]
99,Skrillex,Skrillex,0.802574,200,"[u'Skrillex', u'Mac Miller', u'Mac DeMarco', u'Steve Angello', u'Modest Mouse']",[  0.          73.74279626  74.33707016  76.15116545  77.11679454]
100,Dani Martín,_danielmartin_,0.802262,200,"[u'Dani Mart\xedn', u'Reik', u'Alejandro Sanz', u'Marco Antonio Sol\xeds', u'La Oreja de Van Gogh']",[   0.          134.32795688  136.85759022  138.07968714  138.45576911]
101,Fleetwood Mac,fleetwoodmac,0.802116,118,"[u'Fleetwood Mac', u'Marina and The Diamonds', u'MGMT', u'The Weeknd', u'Guy Sebastian']",[   0.          119.0924011   119.32309081  120.79735096  123.64869591]
102,Franz Ferdinand,Franz_Ferdinand,0.802096,200,"[u'Franz Ferdinand', u'Kodaline', u'The Naked And Famous', u'Metronomy', u'All Time Low']",[   0.          147.38724504  147.92903704  150.85423428  151.15224113]
103,Radiohead,radiohead,0.800365,141,"[u'Radiohead', u'Flume', u'Lana Del Rey', u'Marina and The Diamonds', u'JoJo']",[   0.          110.9954954   112.49444431  119.78313738  123.53137253]
104,Sara Bareilles,SaraBareilles,0.800336,200,"[u'Sara Bareilles', u'Christina Perri', u'Daughtry', u'Mary J. Blige', u'Tyler, The Creator']",[   0.          106.17909399  110.90536506  113.21219016  113.77170123]
105,Jack Johnson,jackjohnson,0.799776,195,"[u'Jack Johnson', u'fun.', u'Fall Out Boy', u'Mumford and Sons', u'Bon Iver']",[   0.          179.28468981  181.67003055  182.81411324  186.98663054]
106,Red Hot Chili Peppers,ChiliPeppers,0.799769,200,"[u'Red Hot Chili Peppers', u'Kings of Leon', u'Mumford and Sons', u'The Beatles', u'Empire of the Sun']",[   0.          220.07498722  221.82425476  224.4303901   225.32199183]
107,The Script,thescript,0.799746,199,"[u'The Script', u'Sky Ferreira', u'Dillon Francis', u'Martin Solveig', u'Zedd']",[   0.          193.31321734  196.49173011  198.49181343  199.01256242]
108,Christina Aguilera,xtina,0.79962,200,"[u'Christina Aguilera', u'Carly Rae Jepsen', u'Jason Mraz', u'John Legend', u'Sara Bareilles']",[   0.          139.91425946  143.66627997  145.84923723  146.62196288]
109,Emeli Sande,emelisande,0.799588,200,"[u'Emeli Sande', u'Marina and The Diamonds', u'MGMT', u'Skrillex', u'Mac DeMarco']",[  0.          78.39005039  79.96249121  85.0529247   90.23303165]
110,Of Monsters and Men,monstersandmen,0.799277,200,"[u'Of Monsters and Men', u'The Strypes', u'Cut Copy', u'Rise Against', u'CHVRCHES']",[   0.          126.81088281  131.34306225  131.60167172  136.42213897]
111,Lil Wayne,LilTunechi,0.79915,200,"[u'Lil Wayne', u'Mac Miller', u'Craig Campbell', u'Krewella', u'Boy George']",[   0.          113.42839151  121.47839314  121.57302332  121.61003248]
112,Two Door Cinema Club,TDCinemaClub,0.79897,200,"[u'Two Door Cinema Club', u'Ms Mr', u'The Strypes', u'OneRepublic', u'John Legend']",[   0.          137.12767773  141.60155366  141.74272468  142.30952182]
113,Thomas Rhett,ThomasRhett,0.798851,200,"[u'Thomas Rhett', u'Robin Thicke', u'Carly Rae Jepsen', u'Maya Jane Coles', u'Jason Mraz']",[   0.          128.43675486  132.74411475  135.71661652  136.32681321]
114,The Saturdays,TheSaturdays,0.798306,200,"[u'The Saturdays', u'The Strypes', u'Cut Copy', u'Boy & Bear', u'Kodaline']",[   0.          154.53478573  157.84486054  159.7873587   160.01249951]
115,Michael Bublé,michaelbuble,0.7975,198,"[u'Michael Bubl\xe9', u'fun.', u'Mumford and Sons', u'Bon Iver', u'Jason Mraz']",[   0.          169.49926254  170.5989449   177.1524767   177.94100146]
116,Pink Floyd,pinkfloyd,0.797144,200,"[u'Pink Floyd', u'Matt Redman', u'A.R. Rahman', u'Katie Melua', u'Depeche Mode']",[   0.          231.12550703  234.29041807  238.92048887  240.00416663]
117,Shreya Ghoshal,shreyaghoshal,0.795924,200,"[u'Shreya Ghoshal', u'Guy Sebastian', u'MGMT', u'All Time Low', u'Ed Sheeran']",[   0.          104.32641085  113.23868597  113.83321132  113.99122773]
118,Alan Jackson,OfficialJackson,0.795603,200,"[u'Alan Jackson', u'Bon Iver', u'Rise Against', u'Mumford and Sons', u'fun.']",[   0.          158.44241856  159.18856743  159.33298466  160.07810594]
119,Dizzee Rascal,DizzeeRascal,0.795153,199,"[u'Dizzee Rascal', u'Demi Lovato', u'All Time Low', u'Foxes', u'Sara Bareilles']",[   0.          167.61264869  168.22009392  168.42505752  168.59418733]
120,Jennifer Lopez,JLo,0.794777,199,"[u'Jennifer Lopez', u'Sara Bareilles', u'All Time Low', u'Ariana Grande', u'Guy Sebastian']",[   0.          129.67266481  129.84221193  131.12589371  132.01893804]
121,Carly Rae Jepsen,carlyraejepsen,0.794115,200,"[u'Carly Rae Jepsen', u'Daughtry', u'Sara Bareilles', u'Rihanna', u'Christina Perri']",[   0.          112.08925015  115.21284651  119.20989892  119.57424472]
122,Psy,psy_oppa,0.793622,199,"[u'Psy', u'Lana Del Rey', u'Marilyn Manson', u'Bloc Party', u'Rihanna']",[   0.          134.58083073  135.2479205   136.12494261  137.5936045 ]
123,Empire of the Sun,EmpireOfTheSun,0.793415,200,"[u'Empire of the Sun', u'Halestorm', u'Train', u'Jason Mraz', u'The Strypes']",[   0.          154.42473895  154.47977214  155.5281325   155.53134732]
124,Gavin DeGraw,GavinDeGraw,0.792726,200,"[u'Gavin DeGraw', u'All Time Low', u'Daughtry', u'Guy Sebastian', u'Chase & Status']",[   0.          141.36477638  141.46377628  142.25329522  143.90969391]
125,Ricky Martin,ricky_martin,0.792444,200,"[u'Ricky Martin', u'Inna', u'Lana Del Rey', u'JoJo', u'Flume']",[  0.          86.94250974  95.94269123  97.50897395  99.45853407]
126,LMFAO,LMFAO,0.792432,200,"[u'LMFAO', u'Red Foo', u'Nicki Minaj', u'The Smashing Pumpkins', u'Chris Brown']",[   0.          181.46349495  226.5038631   227.52362515  228.04604798]
127,Moby,thelittleidiot,0.791905,200,"[u'Moby', u'Metronomy', u'All Time Low', u'Feed Me', u'Guy Sebastian']",[   0.          111.94641575  113.57816692  117.23907199  119.24764149]
128,Rizzle Kicks,RizzleKicks,0.791897,200,"[u'Rizzle Kicks', u'Guy Sebastian', u'The Weeknd', u'Flume', u'Marina and The Diamonds']",[   0.          119.44036169  120.59436139  120.77251343  121.43310916]
129,Jake Bugg,JakeBugg,0.790709,198,"[u'Jake Bugg', u'Gabrielle Aplin', u'Labrinth', u'Lucy Rose', u'Natalie Grant']",[   0.          109.09628775  116.67904696  118.          118.9075271 ]
130,Zoé,zoetheband,0.790634,200,"[u'Zo\xe9', u'Iv\xe1n Ferreiro', u'Banda El Recodo', u'Reik', u'La Oreja de Van Gogh']",[   0.          198.02525092  212.64054176  215.08370464  216.5756219 ]
131,Sting,OfficialSting,0.790612,200,"[u'Sting', u'The Avett Brothers', u'fun.', u'Gotye', u'Mumford and Sons']",[   0.          197.19279906  198.73097393  198.97989848  199.01758716]
132,The Rolling Stones,RollingStones,0.790212,200,"[u'The Rolling Stones', u'Jason Mraz', u'Mumford and Sons', u'A.R. Rahman', u'Blur']",[   0.          155.74658905  164.85751424  169.01775055  172.05812971]
