,artist,screen_name,hotttnesss,num_tweets,recommendations,scores
264,fun.,OurNameIsFun,0.752081,200,"[u'fun.', u'Bon Iver', u'Mumford and Sons', u'The Cranberries', u'Nine Inch Nails']",[   0.          126.96850003  129.20526305  134.95184326  135.72766851]
265,R. Kelly,rkelly,0.751736,197,"[u'R. Kelly', u'Mariah Carey', u'Chris Brown', u'Demi Lovato', u'Zendaya']",[   0.          192.25763964  194.06699874  196.24729297  198.23723162]
266,The National,The_National,0.751724,199,"[u'The National', u'Metric', u'You Me At Six', u'The Kooks', u'Cut Copy']",[   0.          152.58112596  154.12332724  154.29841218  155.53777676]
267,Jimi Hendrix,JimiHendrix,0.750654,200,"[u'Jimi Hendrix', u'Metronomy', u'All Time Low', u'Moby', u'will.i.am']",[   0.          207.18590686  208.36986346  208.5041966   211.64593074]
268,MAN WITH A MISSION,mwamjapan,0.750634,200,"[u'MAN WITH A MISSION', u'\u304d\u3083\u308a\u30fc\u3071\u307f\u3085\u3071\u307f\u3085', u'\u7d62\u9999', u'Sky Ferreira', u'Marina and The Diamonds']",[   0.          121.58124855  141.35062787  142.91605928  149.17104277]
269,David Nail,davidnail,0.750615,200,"[u'David Nail', u'Lucy Rose', u'All Time Low', u'Lorde', u'Girls']",[   0.          119.11758896  119.23506196  119.58678857  121.16104985]
270,Fitz & The Tantrums,FitzAndTantrums,0.750443,200,"[u'Fitz & The Tantrums', u'Capital Cities', u'Jason Mraz', u'Bloc Party', u'The Strypes']",[   0.          121.73331508  129.12009913  129.94999038  131.79908953]
271,Rush,rushtheband,0.750214,200,"[u'Rush', u'Tame Impala', u'Massive Attack', u'Mumford and Sons', u'Robbie Williams']",[   0.          141.16302632  145.86980496  150.          153.23185048]
272,Nelly Furtado,NellyFurtado,0.750133,199,"[u'Nelly Furtado', u'All Time Low', u'Guy Sebastian', u'John Newman', u'Marina and The Diamonds']",[   0.          122.65806129  124.8959567   126.47134063  127.39309243]
273,French Montana,FrencHMonTanA,0.749726,199,"[u'French Montana', u'Meek Mill', u'Rick Ross', u'Chris Brown', u'Lana Del Rey']",[   0.          131.49144459  141.26216762  141.48851543  143.16074881]
274,Meek Mill,MeekMill,0.749237,200,"[u'Meek Mill', u'Lana Del Rey', u'Chris Brown', u'French Montana', u'Selena Gomez']",[   0.          129.80369794  129.93459893  131.49144459  132.947358  ]
275,Austin Mahone,AustinMahone,0.749229,199,"[u'Austin Mahone', u'Demi Lovato', u'Zendaya', u'Justin Bieber', u'Chris Brown']",[   0.          204.28656343  209.2510454   209.53997232  213.73815757]
276,Rick Ross,rickyrozay,0.749217,200,"[u'Rick Ross', u'Chris Brown', u'French Montana', u'Meek Mill', u'Lana Del Rey']",[   0.          138.93883546  141.26216762  143.46776641  144.90686664]
277,Lynyrd Skynyrd,Skynyrd,0.748813,200,"[u'Lynyrd Skynyrd', u'Metric', u'Boy & Bear', u'The Strypes', u'Jason Mraz']",[   0.          179.64130928  180.35243275  182.91528094  183.43118601]
278,Abel Pintos,AbelPintos,0.748786,200,"[u'Abel Pintos', u'La Oreja de Van Gogh', u'Dani Mart\xedn', u'Alejandro Sanz', u'Mal\xfa']",[   0.          149.98999967  158.08541995  164.63596205  165.43578815]
279,Travie McCoy,TravieMcCoy,0.748681,200,"[u'Travie McCoy', u'David Guetta', u'Rihanna', u'Big Sean', u'Jason Mraz']",[   0.          122.91053657  123.13001259  123.19090876  123.44229421]
280,Death Cab for Cutie,dcfc,0.748615,199,"[u'Death Cab for Cutie', u'M83', u'Maroon 5', u'Kings of Leon', u'Bon Iver']",[   0.          202.25478981  206.75831301  207.81722739  210.76527228]
281,Gotye,gotye,0.748411,200,"[u'Gotye', u'Mumford and Sons', u'A.R. Rahman', u'Sara Evans', u'Jason Mraz']",[   0.          141.27632498  142.04928722  145.02413592  147.32277489]
282,Barbra Streisand,BarbraStreisand,0.748086,200,"[u'Barbra Streisand', u'The Avett Brothers', u'Mariah Carey', u'Shania Twain', u'Yann Tiersen']",[   0.          185.55592149  190.95287377  192.12756179  194.58417202]
283,Dan Bălan,danbalan1,0.748042,200,"[u'Dan B\u0103lan', u'Selena Gomez', u'Trina', u'Tame Impala', u'Lykke Li']",[   0.          135.04813957  139.5922634   148.0371575   148.89929483]
284,The Naked And Famous,TNAF,0.747795,200,"[u'The Naked And Famous', u'All Time Low', u'Metronomy', u'Sara Bareilles', u'Moby']",[   0.          121.07848694  121.76206306  123.29639086  123.80630032]
285,Akon,Akon,0.747777,200,"[u'Akon', u'Selena Gomez', u'Lykke Li', u'Trina', u'Ludacris']",[   0.           93.8349615    98.57991682  109.89540482  111.97321108]
286,Eric Church,ericchurch,0.747465,200,"[u'Eric Church', u'Maroon 5', u'Halestorm', u'Empire of the Sun', u'Eminem']",[   0.          190.02894516  208.39865643  211.11371343  212.01179212]
287,Red Foo,RedFoo,0.747221,200,"[u'Red Foo', u'Demi Lovato', u'All Time Low', u'Daughtry', u'Sara Bareilles']",[   0.          154.45063936  155.81078268  156.46405338  156.94266469]
288,Sebastian Ingrosso,SebIngrosso,0.747027,198,"[u'Sebastian Ingrosso', u'The Kooks', u'Lana Del Rey', u'Meek Mill', u'Chris Brown']",[   0.          174.42190229  177.14683175  178.44887223  178.92177061]
289,Timomatic,Timomatictheone,0.747001,199,"[u'Timomatic', u'All Time Low', u'Guy Sebastian', u'John Newman', u'Ed Sheeran']",[   0.          124.24169992  127.98437405  129.22074137  129.67652062]
290,Espinoza Paz,EspinozaOficial,0.746514,200,"[u'Espinoza Paz', u'Reik', u'Larry Hernandez', u'Alejandro Fern\xe1ndez', u'Noel Torres']",[   0.          129.35609765  131.68143377  132.77424449  135.95955281]
291,NxZero,nxzerooficial,0.745777,200,"[u'NxZero', u'CPM 22', u'Luan Santana', u'Capital Inicial', u'Daniel']",[   0.          195.04614839  220.44500448  230.24769271  236.34508668]
292,Sevyn Streeter,sevyn_streeter,0.745698,15,"[u'Sevyn Streeter', u'Nicolas Jaar', u'Sleigh Bells', u'Crystal Castles', u'Atif Aslam']",[  0.          27.78488798  33.27160952  40.70626487  66.9178601 ]
293,Sheryl Crow,SherylCrow,0.744863,199,"[u'Sheryl Crow', u'Jason Mraz', u'David Guetta', u'Sara Evans', u'Robin Thicke']",[   0.          143.45033984  150.08997302  151.55856954  151.92432327]
294,Roberto Tapia,roberto__tapia,0.744862,199,"[u'Roberto Tapia', u'Larry Hernandez', u'Alejandro Fern\xe1ndez', u'Vicente Fern\xe1ndez', u'Dani Mart\xedn']",[   0.          118.64653387  135.12216695  140.35668848  143.01748145]
295,Pentatonix,PTXofficial,0.744222,200,"[u'Pentatonix', u'Bastille', u'MGMT', u'Daughtry', u'Tori Kelly']",[   0.          123.86686401  131.58267363  131.62446581  132.82319075]
296,Rod Stewart,rodstewart,0.743974,200,"[u'Rod Stewart', u'Chase & Status', u'John Legend', u'Guy Sebastian', u'Daughtry']",[   0.          135.34031181  136.02573286  137.88038294  138.47382424]
297,Gabrielle Aplin,GabrielleAplin,0.743836,200,"[u'Gabrielle Aplin', u'Duke Dumont', u'Krewella', u'Emeli Sande', u'Sia']",[  0.          88.70738413  91.68969408  91.88579869  93.05374791]
298,Banda El Recodo,ElRecodoOficial,0.74378,200,"[u'Banda El Recodo', u'Banda Los Recoditos', u'La Oreja de Van Gogh', u'Iv\xe1n Ferreiro', u'No te va Gustar']",[   0.          141.41782066  196.03316046  196.71807238  201.62341134]
299,Chase Rice,ChaseRiceMusic,0.743759,200,"[u'Chase Rice', u'Girls', u'Mac Miller', u'Craig Campbell', u'Lucy Rose']",[   0.           93.33809512   96.38464608  101.9166326   103.45530436]
300,Schoolboy Q,ScHoolBoyQ,0.743713,199,"[u'Schoolboy Q', u'Kendrick Lamar', u'Sky Ferreira', u'Wiz Khalifa', u'Marina and The Diamonds']",[   0.          127.29886095  142.89506639  146.26346092  146.92174788]
301,blink-182,blink182,0.743713,200,"[u'blink-182', u'Tame Impala', u'Selena Gomez', u'James Blake', u'Korpiklaani']",[   0.          120.87596949  127.38916751  133.74602798  137.68442178]
302,Five Finger Death Punch,FFDP,0.743618,199,"[u'Five Finger Death Punch', u'The Smashing Pumpkins', u'A.R. Rahman', u'Mariah Carey', u'The Avett Brothers']",[   0.          242.12600026  249.24686558  250.13596303  252.04364701]
303,Kylie Minogue,kylieminogue,0.743375,200,"[u'Kylie Minogue', u'Lana Del Rey', u'Rihanna', u'The Kooks', u'Big Sean']",[   0.          127.3302792   128.73616431  131.95074839  133.14653582]
304,The Strokes,thestrokes,0.743265,80,"[u'The Strokes', u'Modest Mouse', u'Rammstein', u'2PM', u'Skrillex']",[  0.          78.85429601  88.61151167  89.3028555   90.5704146 ]
305,Jake Owen,jakeowen,0.743147,200,"[u'Jake Owen', u'Sara Bareilles', u'Carrie Underwood', u'Daughtry', u'John Legend']",[   0.          142.81806608  146.570802    149.5760676   149.73643511]
306,Carrie Underwood,carrieunderwood,0.742731,200,"[u'Carrie Underwood', u'Ariana Grande', u'Sara Bareilles', u'Katie Melua', u'Goldfrapp']",[   0.          114.15340556  115.96551211  122.26610323  125.03199591]
307,The Doors,TheDoors,0.742349,199,"[u'The Doors', u'A.R. Rahman', u'Jason Mraz', u'Moby', u'Matt Redman']",[   0.          184.58602331  194.36048981  195.48913013  197.41580484]
308,Mia Martina,MiaMartina,0.742245,199,"[u'Mia Martina', u'Inna', u'Flume', u'Christina Perri', u'Iggy Azalea']",[   0.          135.69082504  137.97463535  138.53880323  138.66506409]
309,Washed Out,ernestgreene,0.742224,199,"[u'Washed Out', u'Editors', u'CHVRCHES', u'Kodaline', u'Yann Tiersen']",[   0.          181.78558799  182.37324365  186.34645154  187.11761007]
310,Kenny Rogers,_KennyRogers,0.742207,200,"[u'Kenny Rogers', u'The Avett Brothers', u'Lady Antebellum', u'A.R. Rahman', u'Jason Mraz']",[   0.          198.67561501  205.01707246  206.9830911   207.48975878]
311,Helene Fischer,_Helene_Fischer,0.741617,102,"[u'Helene Fischer', u'Andrea Berg', u'Marteria', u'\u304d\u3083\u308a\u30fc\u3071\u307f\u3085\u3071\u307f\u3085', u'Led Zeppelin']",[   0.          151.7300234   157.55951257  159.30787802  174.92855685]
312,Chris Tomlin,christomlin,0.741386,200,"[u'Chris Tomlin', u'Katie Melua', u'Maya Jane Coles', u'Matthew West', u'John Legend']",[   0.          140.59871977  140.7160261   141.48498154  144.10759869]
313,Mayday Parade,Mayday_Parade,0.740875,199,"[u'Mayday Parade', u'Bon Iver', u'Nine Inch Nails', u'fun.', u'The Lumineers']",[   0.          144.9517161   145.54037241  149.49916388  149.83991458]
314,50 Cent,50cent,0.740538,200,"[u'50 Cent', u'Selena Gomez', u'Lykke Li', u'Ludacris', u'Akon']",[   0.          175.70145133  175.78395831  180.09441968  180.52700629]
315,Andrea Berg,Andrea_Berg,0.740329,95,"[u'Andrea Berg', u'Marteria', u'\u304d\u3083\u308a\u30fc\u3071\u307f\u3085\u3071\u307f\u3085', u'Led Zeppelin', u'Helene Fischer']",[   0.          133.66749792  136.2901317   151.3274595   151.7300234 ]
316,Mary J. Blige,maryjblige,0.740178,200,"[u'Mary J. Blige', u'Sara Bareilles', u'Daughtry', u'Carly Rae Jepsen', u'Christina Perri']",[   0.          113.21219016  116.50321884  123.91529365  126.69254122]
317,赤西仁,Jin_Akanishi,0.740102,199,"[u'\u8d64\u897f\u4ec1', u'Krewella', u'Sia', u'Mac Miller', u'Steve Angello']",[   0.           98.52410872  102.17142458  105.00952338  108.01851693]
318,Def Leppard,def_leppard,0.739955,197,"[u'Def Leppard', u'Chase & Status', u'John Legend', u'The Kooks', u'Active Child']",[   0.          154.66415228  154.98709624  155.24174696  155.76905983]
319,Shania Twain,ShaniaTwain,0.73969,199,"[u'Shania Twain', u'Jason Mraz', u'Maya Jane Coles', u'Avicii', u'A.R. Rahman']",[   0.          139.01798445  146.64242224  147.0238076   147.451687  ]
320,The Band Perry,thebandperry,0.739476,200,"[u'The Band Perry', u'Jason Mraz', u'The Strypes', u'Mariah Carey', u'Metric']",[   0.          129.4681428   135.67977005  138.27508814  138.38352503]
321,Cher Lloyd,CherLloyd,0.739445,198,"[u'Cher Lloyd', u'John Newman', u'Daughtry', u'Marina and The Diamonds', u'Tori Kelly']",[   0.          158.42663917  161.74362429  161.88576219  162.89260266]
322,Elissa,elissakh,0.739419,200,"[u'Elissa', u'Flume', u'Lana Del Rey', u'Marina and The Diamonds', u'Iggy Azalea']",[   0.          127.20455967  127.48333224  131.34306225  132.28000605]
323,T-Pain,TPAIN,0.738997,199,"[u'T-Pain', u'All Time Low', u'Metronomy', u'will.i.am', u'Moby']",[   0.          153.16984037  156.58543994  157.61662349  160.2716444 ]
324,Booba,booba,0.738666,200,"[u'Booba', u'Trina', u'Selena Gomez', u'The 1975', u'Gerardo Ortiz']",[   0.          168.2171216   173.53673963  176.24131184  183.89942904]
325,My Chemical Romance,MCRofficial,0.738131,200,"[u'My Chemical Romance', u'Eminem', u'Sub Focus', u'John Legend', u'Jason Mraz']",[   0.          188.47015679  192.22642898  192.45778758  193.37528281]
326,Sorriso Maroto,sorrisomaroto,0.737996,200,"[u'Sorriso Maroto', u'Luan Santana', u'CPM 22', u'Ivete Sangalo', u'Trina']",[   0.          212.07781591  218.8241303   236.31335129  239.02719511]
327,Ivete Sangalo,ivetesangalo,0.737807,200,"[u'Ivete Sangalo', u'\u304d\u3083\u308a\u30fc\u3071\u307f\u3085\u3071\u307f\u3085', u'Luan Santana', u'Ricky Martin', u'Dima Bilan']",[   0.          143.96874661  144.12147654  153.06534552  155.9455033 ]
328,Kid Cudi,ducidni,0.737782,198,"[u'Kid Cudi', u'Ed Sheeran', u'Lorde', u'All Time Low', u'Lucy Spraggan']",[   0.          152.47294842  152.7023248   152.78743404  154.82893786]
329,Justin Moore,JustinColeMoore,0.73759,198,"[u'Justin Moore', u'Lucy Spraggan', u'Ariana Grande', u'All Time Low', u'Cassadee Pope']",[   0.          173.00289015  175.96306431  176.92936444  176.94631954]
330,Boy George,BoyGeorge,0.737052,200,"[u'Boy George', u'Krewella', u'Sia', u'MGMT', u'Mac Miller']",[  0.          82.72242743  85.07055895  87.04596487  87.14929719]
331,Daniel,cantordaniel,0.735806,200,"[u'Daniel', u'Luan Santana', u'Ivete Sangalo', u'CPM 22', u'Capital Inicial']",[   0.          165.92468171  169.66437458  183.57015008  184.33936096]
332,JoJo,JoJoistheway,0.735645,200,"[u'JoJo', u'Marina and The Diamonds', u'Iggy Azalea', u'Inna', u'Flume']",[  0.          81.58431222  82.77076779  85.79627032  88.10221337]
333,Scotty McCreery,ScottyMcCreery,0.73479,200,"[u'Scotty McCreery', u'All Time Low', u'Guy Sebastian', u'Metronomy', u'John Newman']",[   0.          123.28828006  126.74383614  128.70897405  131.60547101]
334,Katie Melua,katiemelua,0.734627,200,"[u'Katie Melua', u'John Legend', u'Goldfrapp', u'Metronomy', u'Tom Odell']",[   0.          114.99130402  119.08820261  120.11244732  120.53630159]
335,Rise Against,riseagainst,0.734377,200,"[u'Rise Against', u'Bloc Party', u'The Kooks', u'Cut Copy', u'The Strypes']",[   0.          112.53443917  124.69963913  128.37445229  128.50680916]
336,Fatboy Slim,FatboySlim,0.734265,200,"[u'Fatboy Slim', u'Calvin Harris', u'The Kooks', u'Chris Brown', u'Mariah Carey']",[   0.          183.25119372  184.7809514   186.54222042  190.13942253]
337,James Blake,jamesblake,0.733722,200,"[u'James Blake', u'Selena Gomez', u'Tame Impala', u'Trina', u'Lykke Li']",[   0.          105.54619842  109.29318368  109.69958979  124.06046913]
338,Pixies,PIXIES,0.733649,200,"[u'Pixies', u'Bloc Party', u'The Kooks', u'Chris Brown', u'Editors']",[   0.          159.78110026  159.8812059   160.24356461  161.499226  ]
339,Nicky Romero,nickyromero,0.733359,200,"[u'Nicky Romero', u'Marina and The Diamonds', u'Skrillex', u'Emeli Sande', u'MGMT']",[  0.          86.60831369  90.05553842  94.75230868  94.95261976]
340,Daughter,ohdaughter,0.733268,200,"[u'Daughter', u'Editors', u'Mumford and Sons', u'Gogol Bordello', u'fun.']",[   0.          203.09357449  207.29930053  207.43191654  211.01421753]
341,Axwell,Axwell,0.732745,197,"[u'Axwell', u'The Kooks', u'Chris Brown', u'Meek Mill', u'Fall Out Boy']",[   0.          257.8875724   259.07141872  259.73255476  262.33756879]
342,Goldfrapp,goldfrapp,0.732607,200,"[u'Goldfrapp', u'Guy Sebastian', u'MGMT', u'Hilltop Hoods', u'Emeli Sande']",[   0.           90.42676595  101.48891565  102.56217626  103.54709074]
343,Iron Maiden,IronMaiden,0.73232,200,"[u'Iron Maiden', u'Marilyn Manson', u'Korpiklaani', u'Stone Temple Pilots', u'Milk & Sugar']",[   0.          146.53668483  157.20050891  162.99079729  168.60011862]
344,The Civil Wars,thecivilwars,0.732288,200,"[u'The Civil Wars', u'The Smashing Pumpkins', u'A.R. Rahman', u'The Avett Brothers', u'Mariah Carey']",[   0.          204.5140582   208.0793118   209.61154548  211.43556938]
345,Yann Tiersen,yanntiersen,0.73221,198,"[u'Yann Tiersen', u'CHVRCHES', u'The Strypes', u'Kodaline', u'The Naked And Famous']",[   0.          129.70350805  129.84221193  130.24592124  135.66134306]
346,Il Volo,ilvolo,0.73172,200,"[u'Il Volo', u'Marina and The Diamonds', u'MGMT', u'Emeli Sande', u'Ricky Martin']",[   0.          122.26201372  122.43773928  128.19126335  129.91535706]
347,Stone Temple Pilots,STPBand,0.731581,200,"[u'Stone Temple Pilots', u'Iron Maiden', u'Marilyn Manson', u'fun.', u'Bon Iver']",[   0.          162.99079729  163.89325795  166.18363337  166.6133248 ]
348,Banks,hernameisbanks,0.731434,198,"[u'Banks', u'Demi Lovato', u'The Kooks', u'Mariah Carey', u'Chris Brown']",[   0.          183.91302292  193.07770456  193.50452191  193.60010331]
349,Edward Sharpe & the Magnetic Zeros,EdwardSharpe,0.730901,199,"[u'Edward Sharpe & the Magnetic Zeros', u'Demi Lovato', u'The Naked And Famous', u'Metronomy', u'Moby']",[   0.          167.71404235  169.06211876  169.19810874  169.71741219]
350,Massive Attack,MassiveAttackUK,0.730614,200,"[u'Massive Attack', u'Lou Reed', u'Tame Impala', u'Selena Gomez', u'Korpiklaani']",[   0.           97.34988444  109.60383205  114.77804668  124.47891388]
351,The Offspring,offspring,0.730467,199,"[u'The Offspring', u'Goldfrapp', u'Guy Sebastian', u'Chase & Status', u'All Time Low']",[   0.          118.92014127  120.65239326  124.15715847  124.85591696]
352,Aerosmith,Aerosmith,0.730432,200,"[u'Aerosmith', u'Mumford and Sons', u'Jason Mraz', u'Kings of Leon', u'fun.']",[   0.          157.27046767  164.86054713  165.34509367  165.75282803]
353,Casting Crowns,castingcrowns,0.730421,200,"[u'Casting Crowns', u'Natalie Grant', u'Passion Pit', u'Cassadee Pope', u'Los Campesinos!']",[   0.          347.53704838  347.72690434  349.18619675  350.33269902]
354,Craig Campbell,craigcampbelltv,0.730099,200,"[u'Craig Campbell', u'Lorde', u'Girls', u'Ed Sheeran', u'Emeli Sande']",[  0.          95.98958277  96.71090942  96.95359715  97.50384608]
355,New Politics,NewPolitics,0.730082,200,"[u'New Politics', u'Kodaline', u'Ms Mr', u'Bastille', u'The Naked And Famous']",[   0.          131.72319462  133.9141516   137.42270555  137.75703249]
356,Trey Songz,TreySongz,0.729845,198,"[u'Trey Songz', u'Emeli Sande', u'Marina and The Diamonds', u'Wiz Khalifa', u'JoJo']",[   0.          116.14215428  118.60016863  123.14625451  123.28016872]
357,Psy 4 de la Rime,PSY4OFFICIEL,0.729826,200,"[u'Psy 4 de la Rime', u'Crystal Castles', u'Sevyn Streeter', u'Sleigh Bells', u'Nicolas Jaar']",[   0.          211.77346387  211.96933741  212.46176127  213.66562662]
358,Bliss n Eso,blissneso,0.729493,200,"[u'Bliss n Eso', u'The Strypes', u'Jason Mraz', u'Rise Against', u'Bloc Party']",[   0.          129.86916493  131.5560717   131.60547101  139.80700984]
359,Editors,editorsofficial,0.729299,199,"[u'Editors', u'Marilyn Manson', u'The Kooks', u'You Me At Six', u'Bloc Party']",[   0.          127.04329971  127.99218726  128.52237159  131.32402674]
360,Mac Miller,MacMiller,0.729254,200,"[u'Mac Miller', u'Skrillex', u'Steve Angello', u'Mac DeMarco', u'Modest Mouse']",[  0.          73.74279626  76.79192666  78.39642849  80.5294977 ]
361,Duke Dumont,DukeDumont,0.729114,199,"[u'Duke Dumont', u'Gabrielle Aplin', u'Martin Garrix', u'Mac Miller', u'Modest Mouse']",[  0.          88.70738413  90.28842672  91.33454987  91.65696918]
362,The Strypes,The_Strypes,0.728725,198,"[u'The Strypes', u'Jason Mraz', u'Kodaline', u'CHVRCHES', u'Metric']",[   0.          120.16239012  120.55289296  123.00406497  124.04434691]
363,Guy Sebastian,GuySebastian,0.728014,200,"[u'Guy Sebastian', u'MGMT', u'Goldfrapp', u'Ed Sheeran', u'All Time Low']",[  0.          88.98876334  90.42676595  95.64517761  95.96874491]
364,Parov Stelar,parov_stelar,0.727945,200,"[u'Parov Stelar', u'Katie Melua', u'Boy & Bear', u'Avicii', u'John Legend']",[   0.          141.46731071  142.07744367  145.67772651  146.58103561]
365,Anna Kendrick,AnnaKendrick47,0.72771,200,"[u'Anna Kendrick', u'Sia', u'Alex Clare', u'Boy George', u'Lorde']",[   0.          104.36953579  114.83030959  115.03043076  115.98275734]
366,The Smashing Pumpkins,SmashingPumpkin,0.727335,200,"[u'The Smashing Pumpkins', u'The Avett Brothers', u'Gogol Bordello', u'Mariah Carey', u'The Kooks']",[   0.          162.47153597  167.32901721  168.70388259  169.95293466]
367,Bruce Springsteen,springsteen,0.726944,199,"[u'Bruce Springsteen', u'Mumford and Sons', u'fun.', u'Jason Mraz', u'Kings of Leon']",[   0.          149.33184523  157.81001236  164.78167374  164.81201413]
368,Emis Killa,RealEmisKilla,0.726904,200,"[u'Emis Killa', u'\u7d62\u9999', u'Sky Ferreira', u'\u304d\u3083\u308a\u30fc\u3071\u307f\u3085\u3071\u307f\u3085', u'MAN WITH A MISSION']",[   0.          189.52572385  193.98195792  195.13585011  202.94826927]
369,BoA,BoAkwon,0.72668,200,"[u'BoA', u'\u304d\u3083\u308a\u30fc\u3071\u307f\u3085\u3071\u307f\u3085', u'Marina and The Diamonds', u'JoJo', u'Inna']",[   0.          100.4788535   115.52488909  116.713324    119.07560623]
370,Passion Pit,passionpit,0.726595,200,"[u'Passion Pit', u'Anna Kendrick', u'Los Campesinos!', u'Seal', u'Lucy Spraggan']",[   0.          145.42008114  149.689679    156.0416611   158.42032698]
371,Metric,Metric,0.726294,200,"[u'Metric', u'John Legend', u'The Strypes', u'Sara Bareilles', u'Carly Rae Jepsen']",[   0.          121.02892216  124.04434691  124.92397688  124.9799984 ]
372,Moderat,ModeratOfficial,0.725854,199,"[u'Moderat', u'The Kooks', u'Chris Brown', u'Bloc Party', u'Meek Mill']",[   0.          181.46073956  186.02150413  186.71904027  190.25509192]
373,DK,TheRealD_K,0.72539,200,"[u'DK', u'Lorde', u'Mac Miller', u'Girls', u'Dillon Francis']",[   0.          124.36237373  130.77843859  132.83448347  134.48419982]
374,Boy & Bear,boyandbear,0.725269,200,"[u'Boy & Bear', u'The Strypes', u'Metric', u'Nickelback', u'Parov Stelar']",[   0.          130.31116606  140.15705476  141.79562758  142.07744367]
375,Maher Zain,MaherZain,0.725141,200,"[u'Maher Zain', u'All Time Low', u'Guy Sebastian', u'Rizzle Kicks', u'John Newman']",[   0.          134.23859356  139.82846634  142.45701106  142.55525245]
376,Kiss,KISSOnline,0.724876,200,"[u'Kiss', u'Tame Impala', u'fun.', u'blink-182', u'James Blake']",[   0.          223.76997118  226.10616975  227.66642265  229.34253857]
377,Anna Calvi,annacalvi,0.724743,200,"[u'Anna Calvi', u'The Kooks', u'Chris Brown', u'Mariah Carey', u'Editors']",[   0.          174.47635943  175.755512    177.19762978  179.16472867]
378,Max Herre,MaxHerreMusik,0.724397,200,"[u'Max Herre', u'Trina', u'Selena Gomez', u'The 1975', u'Mc Fitti']",[   0.          206.04368469  207.40781085  210.12853209  215.59452683]
379,DJ Shadow,djshadow,0.724093,200,"[u'DJ Shadow', u'Harry Connick, Jr.', u'Ed Sheeran', u'Cassadee Pope', u'Anna Kendrick']",[   0.          147.30241003  149.81655449  157.43252523  159.62142713]
380,Nicolas Jaar,nicolas___jaar,0.724088,23,"[u'Nicolas Jaar', u'Sevyn Streeter', u'Sleigh Bells', u'Crystal Castles', u'Atif Aslam']",[  0.          27.78488798  32.32645975  46.80811895  61.49796745]
381,Capital Inicial,capitalinicial,0.723796,199,"[u'Capital Inicial', u'Luan Santana', u'Ivete Sangalo', u'Grupo Bom Gosto', u'Daniel']",[   0.          163.0950643   169.5788902   174.66253176  184.33936096]
382,Chenoa,Chenoaoficial,0.723569,200,"[u'Chenoa', u'Noel Torres', u'Reik', u'Mal\xfa', u'La Oreja de Van Gogh']",[   0.          193.43991315  195.7115224   199.69727089  200.35218991]
383,Marilyn Manson,marilynmanson,0.723378,198,"[u'Marilyn Manson', u'Akon', u'Bloc Party', u'Lykke Li', u'Editors']",[   0.          125.05598746  125.47509713  125.66224572  127.04329971]
384,Bob Sinclar,bobsinclar,0.72328,199,"[u'Bob Sinclar', u'The Kooks', u'Lana Del Rey', u'Rihanna', u'Bloc Party']",[   0.          130.3303495   134.80356078  138.26062346  139.90711204]
385,Hillsong United,hillsongunited,0.72323,199,"[u'Hillsong United', u'The Kooks', u'Bloc Party', u'Demi Lovato', u'Kodaline']",[   0.          182.1565261   184.38275407  187.59530911  188.24452183]
386,Il Divo,ildivoofficial,0.723081,200,"[u'Il Divo', u'The Strypes', u'Jason Mraz', u'A.R. Rahman', u'Lady Antebellum']",[   0.          175.37388631  177.21455922  177.39503939  177.42885898]
387,Blur,blurofficial,0.722115,200,"[u'Blur', u'Jason Mraz', u'The Strypes', u'Rise Against', u'Mumford and Sons']",[   0.          133.9888055   139.38436067  142.44297104  143.15725619]
388,Rohff,rohff,0.721857,192,"[u'Rohff', u'Booba', u'Trina', u'Gerardo Ortiz', u'The 1975']",[   0.          224.37914342  233.57011795  234.06622994  234.90210727]
389,Ne-Yo,NeYoCompound,0.721441,200,"[u'Ne-Yo', u'David Guetta', u'Jason Mraz', u'Sara Evans', u'Mariah Carey']",[   0.          116.22392181  119.56169955  127.65187033  127.94139283]
390,Iván Ferreiro,ivanferreiro,0.721398,200,"[u'Iv\xe1n Ferreiro', u'La Oreja de Van Gogh', u'Dani Mart\xedn', u'Sergio Contreras', u'Reik']",[   0.          174.59381432  177.06213599  177.71325218  186.07256649]
391,Marteria,marteria,0.721392,199,"[u'Marteria', u'\u304d\u3083\u308a\u30fc\u3071\u307f\u3085\u3071\u307f\u3085', u'Andrea Berg', u'Marina and The Diamonds', u'Led Zeppelin']",[   0.          122.37646833  133.66749792  145.23773614  147.3533169 ]
392,Sander van Doorn,SandervanDoorn,0.721378,200,"[u'Sander van Doorn', u'Passenger', u'Martin Garrix', u'Gabrielle Aplin', u'Duke Dumont']",[   0.          108.28665661  108.44814429  110.5983725   113.83760363]
393,Matthew West,matthew_west,0.720921,200,"[u'Matthew West', u'All Time Low', u'John Legend', u'Carly Rae Jepsen', u'Active Child']",[   0.          134.51022266  134.56968455  135.0074072   136.1469794 ]
394,Richard Clayderman,claydermanmusic,0.72082,60,"[u'Richard Clayderman', u'Modest Mouse', u'Atif Aslam', u'Sleigh Bells', u'Nicolas Jaar']",[  0.          80.2371485   81.9390017   84.90583019  86.48699324]
