,artist,screen_name,hotttnesss,num_tweets,recommendations,scores
133,Elton John,eltonjohndotcom,0.790085,200,"[u'Elton John', u'The Beatles', u'Mumford and Sons', u'Kings of Leon', u'Maroon 5']",[   0.          205.69394741  220.2112622   220.54024576  221.54683478]
134,Led Zeppelin,ledzeppelin,0.788932,46,"[u'Led Zeppelin', u'Crystal Castles', u'Sleigh Bells', u'Sevyn Streeter', u'Rammstein']",[  0.          72.40165744  78.77816956  79.85612062  81.76184929]
135,A Day to Remember,joshuawoodard,0.788376,200,"[u'A Day to Remember', u'JoJo', u'Iggy Azalea', u'Flume', u'Inna']",[   0.          108.2266141   108.68302535  110.05907505  111.51681488]
136,Lady Antebellum,ladyantebellum,0.786813,200,"[u'Lady Antebellum', u'Jason Mraz', u'A.R. Rahman', u'The Avett Brothers', u'The Strypes']",[   0.          158.5622906   159.8937147   160.24980499  165.04847773]
137,Green Day,GreenDay,0.786454,200,"[u'Green Day', u'fun.', u'Bon Iver', u'Fall Out Boy', u'Mumford and Sons']",[   0.          157.4896822   160.14992975  161.91355718  163.8200232 ]
138,Inna,inna_ro,0.786131,199,"[u'Inna', u'JoJo', u'Ricky Martin', u'Flume', u'Marina and The Diamonds']",[  0.          85.79627032  86.94250974  89.29165695  91.21951546]
139,Lata Mangeshkar,mangeshkarlata,0.785858,200,"[u'Lata Mangeshkar', u'Lana Del Rey', u'JoJo', u'Lykke Li', u'Rihanna']",[   0.          254.47200239  256.28304665  257.07002937  257.29360661]
140,Tim McGraw,TheTimMcGraw,0.785631,199,"[u'Tim McGraw', u'John Legend', u'Daughtry', u'Carly Rae Jepsen', u'Robin Thicke']",[   0.          138.37268517  142.19353009  142.8600714   144.27751037]
141,Havana Brown,djhavanabrown,0.785552,196,"[u'Havana Brown', u'Daughtry', u'Sara Bareilles', u'Birdy', u'Tori Kelly']",[   0.          153.3623161   155.20953579  157.14324675  159.30787802]
142,Wilkinson,WilkinsonUK,0.785349,200,"[u'Wilkinson', u'John Newman', u'All Time Low', u'Foxes', u'Guy Sebastian']",[   0.          134.38749942  136.05146085  139.61017155  140.13564857]
143,Nine Inch Nails,nineinchnails,0.785348,200,"[u'Nine Inch Nails', u'Bon Iver', u'fun.', u'Mayday Parade', u'Booka Shade']",[   0.          134.21996871  135.72766851  145.54037241  147.62791064]
144,Lykke Li,LykkeLi,0.785162,200,"[u'Lykke Li', u'Selena Gomez', u'Trina', u'Akon', u'Ludacris']",[   0.           78.33900689   90.11659115   98.57991682  110.41738993]
145,Alejandro Sanz,AlejandroSanz,0.784345,200,"[u'Alejandro Sanz', u'Reik', u'David Bisbal', u'Dani Mart\xedn', u'Alejandro Fern\xe1ndez']",[   0.          126.60963628  130.09611831  136.85759022  139.06113763]
146,Zendaya,Zendaya,0.784342,200,"[u'Zendaya', u'The Kooks', u'Demi Lovato', u'Mariah Carey', u'All Time Low']",[   0.          131.98484762  132.87211897  133.03007179  136.53937161]
147,Steve Aoki,steveaoki,0.784279,200,"[u'Steve Aoki', u'Akon', u'Marilyn Manson', u'Ludacris', u'Lykke Li']",[   0.          133.96268137  137.48090777  139.8856676   140.02856851]
148,Agnes Obel,agnesobel,0.784252,147,"[u'Agnes Obel', u'Vampire Weekend', u'Flume', u'Radiohead', u'Marina and The Diamonds']",[   0.          135.45848072  135.88598162  140.13208055  140.88647912]
149,Christina Perri,christinaperri,0.784045,200,"[u'Christina Perri', u'Marina and The Diamonds', u'JoJo', u'Iggy Azalea', u'Guy Sebastian']",[  0.          90.12213934  92.98386957  94.29209935  96.50906693]
150,Wiz Khalifa,wizkhalifa,0.783989,200,"[u'Wiz Khalifa', u'Marina and The Diamonds', u'Emeli Sande', u'MGMT', u'Skrillex']",[  0.          88.72992731  91.69514709  94.50925881  97.81615409]
151,MGMT,whoisMGMT,0.783861,200,"[u'MGMT', u'Emeli Sande', u'Marina and The Diamonds', u'Mac Miller', u'Boy George']",[  0.          79.96249121  83.40863265  85.39320816  87.04596487]
152,Alesso,Alesso,0.783272,198,"[u'Alesso', u'Calvin Harris', u'The Kooks', u'Chris Brown', u'Mariah Carey']",[   0.          203.55343279  208.13216955  213.03755537  213.54156504]
153,Jessica Mauboy,jessicamauboy,0.782921,195,"[u'Jessica Mauboy', u'Eliza Doolittle', u'Ariana Grande', u'All Time Low', u'Lorde']",[   0.          150.96688379  151.04304022  151.76626766  153.03921066]
154,The Black Keys,theblackkeys,0.782857,200,"[u'The Black Keys', u'Mumford and Sons', u'Kings of Leon', u'M83', u'The Cranberries']",[   0.          175.88348416  178.52170736  188.42770497  189.9078724 ]
155,Sub Focus,subfocus,0.782497,199,"[u'Sub Focus', u'Maya Jane Coles', u'John Legend', u'Tom Odell', u'Avicii']",[   0.          116.20240961  118.43563653  130.03461078  131.72319462]
156,Lawson,LawsonOfficial,0.782288,200,"[u'Lawson', u'Gabrielle Aplin', u'Lucy Rose', u'Lucy Spraggan', u'All Time Low']",[   0.          129.86531485  131.63206296  132.64614582  132.947358  ]
157,Shakira,shakira,0.782161,200,"[u'Shakira', u'Selena Gomez', u'Ricky Martin', u'Lykke Li', u'Akon']",[   0.          204.31837901  204.60938395  206.51634318  207.58371805]
158,Tegan and Sara,teganandsara,0.782124,200,"[u'Tegan and Sara', u'The Avett Brothers', u'Asking Alexandria', u'Halestorm', u'The Strypes']",[   0.          147.16317474  153.74329254  154.34701163  156.84387141]
159,M83,m83news,0.781845,198,"[u'M83', u'fun.', u'Mumford and Sons', u'The Cranberries', u'Kings of Leon']",[   0.          155.59562976  155.98717896  158.7135785   159.65274818]
160,30 Seconds to Mars,30SECONDSTOMARS,0.78171,200,"[u'30 Seconds to Mars', u'You Me At Six', u'The Kooks', u'Editors', u'Fall Out Boy']",[   0.          158.77657258  162.65915283  165.23316858  168.83423823]
161,Cage the Elephant,CageTheElephant,0.781303,200,"[u'Cage the Elephant', u'Flume', u'Bloc Party', u'Sara Bareilles', u'Lana Del Rey']",[   0.          133.15780112  136.56500284  137.51727164  137.60087209]
162,Evanescence,evanescence,0.781187,198,"[u'Evanescence', u'Jason Mraz', u'A.R. Rahman', u'The Strypes', u'Bliss n Eso']",[   0.          159.53996365  162.58843747  163.32789107  166.48723675]
163,The Weeknd,theweeknd,0.781082,200,"[u'The Weeknd', u'Marina and The Diamonds', u'Emeli Sande', u'MGMT', u'Wiz Khalifa']",[   0.           92.37423883   94.43516294   94.72064189  101.20276676]
164,Banda Los Recoditos,BANDARECODITOSS,0.781042,199,"[u'Banda Los Recoditos', u'Banda El Recodo', u'La Oreja de Van Gogh', u'Iv\xe1n Ferreiro', u'No te va Gustar']",[   0.          141.41782066  195.2127045   199.43670675  202.46234218]
165,Krewella,krewellayasmine,0.781006,200,"[u'Krewella', u'Sia', u'Boy George', u'Mac Miller', u'Steve Angello']",[  0.          80.79603951  82.72242743  83.78544026  87.0804226 ]
166,The BossHoss,thebosshoss,0.780675,200,"[u'The BossHoss', u'Marteria', u'Lana Del Rey', u'\u304d\u3083\u308a\u30fc\u3071\u307f\u3085\u3071\u307f\u3085', u'Andrea Berg']",[   0.          166.97604619  179.94999305  182.00824157  183.90758549]
167,きゃりーぱみゅぱみゅ,pamyurin,0.779836,200,"[u'\u304d\u3083\u308a\u30fc\u3071\u307f\u3085\u3071\u307f\u3085', u'Led Zeppelin', u'Crystal Castles', u'BoA', u'Skrillex']",[   0.           86.11039426   99.32270637  100.4788535   102.42558274]
168,Scandal,scandal_band,0.779019,200,"[u'Scandal', u'Massive Attack', u'Lou Reed', u'James Blake', u'Tame Impala']",[   0.          304.97049038  306.28091681  311.71621709  313.37517451]
169,Luan Santana,luansantana,0.77892,200,"[u'Luan Santana', u'Ivete Sangalo', u'CPM 22', u'Capital Inicial', u'Daniel']",[   0.          144.12147654  152.06906326  163.0950643   165.92468171]
170,Cassadee Pope,CassadeePope,0.778848,200,"[u'Cassadee Pope', u'Natalie Grant', u'Kelly Clarkson', u'Labrinth', u'Goldfrapp']",[   0.          104.16813332  104.67568963  105.46089323  110.52149112]
171,Dimitri Vegas,dimitrivegas,0.778785,199,"[u'Dimitri Vegas', u'Marina and The Diamonds', u'Flume', u'Iggy Azalea', u'Zendaya']",[   0.          186.3035158   189.68131168  191.16485033  191.38442988]
172,2PM,follow_2PM,0.778332,63,"[u'2PM', u'Sleigh Bells', u'Modest Mouse', u'Nicolas Jaar', u'Atif Aslam']",[  0.          74.95331881  76.85701009  81.11103501  82.00609733]
173,David Bisbal,davidbisbal,0.778255,200,"[u'David Bisbal', u'Reik', u'Alejandro Sanz', u'Marco Antonio Sol\xeds', u'Alejandro Fern\xe1ndez']",[   0.          129.30197214  130.09611831  130.66369044  140.1392165 ]
174,Juan Magan,JuanMaganMusic,0.777596,174,"[u'Juan Magan', u'Dani Mart\xedn', u'La Oreja de Van Gogh', u'Iv\xe1n Ferreiro', u'Sergio Contreras']",[   0.          188.71936838  192.53830788  195.06921848  197.74225649]
175,Phoenix,wearephoenix,0.777539,200,"[u'Phoenix', u'Vampire Weekend', u'Bloc Party', u'Lana Del Rey', u'Rise Against']",[   0.          127.94920867  128.09371569  131.96211578  136.39648089]
176,Vampire Weekend,vampireweekend,0.777485,150,"[u'Vampire Weekend', u'MGMT', u'Flume', u'Marina and The Diamonds', u'Crystal Fighters']",[   0.          117.81765572  118.24550731  118.38074168  122.33151679]
177,Phillip Phillips,Phillips,0.777288,200,"[u'Phillip Phillips', u'Imagine Dragons', u'Jake Bugg', u'Armin van Buuren', u'Cassadee Pope']",[   0.          148.5631179   156.0032051   161.95987157  162.00308639]
178,Sunidhi Chauhan,SunidhiChauhan5,0.776882,199,"[u'Sunidhi Chauhan', u'Marina and The Diamonds', u'Dillon Francis', u'Sky Ferreira', u'Emeli Sande']",[   0.          121.83595528  123.43419299  125.29565036  125.43922831]
179,Bob Marley,bobmarley,0.776214,200,"[u'Bob Marley', u'Mumford and Sons', u'Robbie Williams', u'fun.', u'Rush']",[   0.          154.81924945  161.7683529   163.5573294   164.48404178]
180,Tyler Farr,tylerfarr,0.776127,199,"[u'Tyler Farr', u'Eli Young Band', u'Demi Lovato', u'Rudimental', u'Mariah Carey']",[   0.          175.41094607  177.00282484  177.25687575  177.71887913]
181,Kodaline,Kodaline,0.775659,200,"[u'Kodaline', u'The Strypes', u'CHVRCHES', u'The Naked And Famous', u'Crystal Fighters']",[   0.          120.55289296  123.73762564  125.24376232  125.34352795]
182,Ed Sheeran,edsheeran,0.775611,200,"[u'Ed Sheeran', u'Alex Clare', u'MGMT', u'Guy Sebastian', u'Craig Campbell']",[  0.          94.12757301  95.38867857  95.64517761  96.95359715]
183,Vitaa,VitaaOfficiel,0.775543,200,"[u'Vitaa', u'Emmanuel Moire', u'Joyce Jonathan', u'\u7d62\u9999', u'Roberto Tapia']",[   0.          233.02574965  235.51220775  274.66889158  278.16002588]
184,Nickelback,Nickelback,0.775506,200,"[u'Nickelback', u'for King & Country', u'Katie Melua', u'Boy & Bear', u'OneRepublic']",[   0.          139.57077058  140.68759718  141.79562758  141.85556034]
185,Kid Ink,Kid_Ink,0.775344,200,"[u'Kid Ink', u'Chris Brown', u'Kendrick Lamar', u'Mariah Carey', u'The Kooks']",[   0.          135.48062592  159.01886681  159.13516268  159.38318606]
186,Family of the Year,FamilyoftheYear,0.77484,198,"[u'Family of the Year', u'Lucy Rose', u'Gabrielle Aplin', u'MGMT', u'Bonobo']",[   0.          119.0336087   119.1091936   119.54078802  123.65678307]
187,Snoop Dogg,SnoopDogg,0.774494,198,"[u'Snoop Dogg', u'Chris Brown', u'Meek Mill', u'Big Sean', u'Ludacris']",[   0.          146.27371603  147.02040675  148.0371575   148.83883902]
188,Oasis,oasis,0.774308,200,"[u'Oasis', u'A.R. Rahman', u'Eminem', u'Editors', u'Gorillaz']",[   0.          240.03541405  241.17628407  242.38399287  244.27034204]
189,Tiësto,tiesto,0.774059,200,"[u'Ti\xebsto', u'Zendaya', u'The Kooks', u'Demi Lovato', u'Chris Brown']",[   0.          191.53328692  191.7159357   191.7759109   192.72000415]
190,Aloe Blacc,aloeblacc,0.773997,198,"[u'Aloe Blacc', u'Chris Brown', u'Mariah Carey', u'Ne-Yo', u'The Kooks']",[   0.          161.80852882  170.5725652   171.41178489  171.41178489]
191,Vasco Rossi,vascorossi,0.773796,200,"[u'Vasco Rossi', u'Trina', u'Selena Gomez', u'The 1975', u'Lykke Li']",[   0.          169.16559934  172.5021739   179.24006249  182.10436568]
192,Foo Fighters,foofighters,0.773752,200,"[u'Foo Fighters', u'Selena Gomez', u'Trina', u'Tame Impala', u'Lykke Li']",[   0.          135.09256086  144.54065172  146.07874589  146.09243649]
193,Ciara,ciara,0.77346,197,"[u'Ciara', u'Lana Del Rey', u'JoJo', u'Flume', u'Iggy Azalea']",[   0.          109.86810274  112.34767465  113.13708499  114.07453704]
194,Babasónicos,Babasonicos_,0.773402,200,"[u'Babas\xf3nicos', u'Gerardo Ortiz', u'Los Inquietos del Norte', u'Trina', u'Selena Gomez']",[   0.          164.25894192  177.83700402  178.09267251  181.67828709]
195,Gusttavo Lima,Gusttavo_lima,0.773098,200,"[u'Gusttavo Lima', u'Pitty', u'Eduardo Costa', u'Munhoz & Mariano', u'Michel Tel\xf3']",[   0.          194.83839457  210.74154787  218.3277353   226.89424849]
196,Karmin,karminmusic,0.77282,200,"[u'Karmin', u'Lucy Rose', u'Gabrielle Aplin', u'Lorde', u'Martin Solveig']",[   0.          122.32742947  125.70600622  125.88883985  128.39003077]
197,CPM 22,CPM22,0.772319,200,"[u'CPM 22', u'Luan Santana', u'Trina', u'Selena Gomez', u'The 1975']",[   0.          152.06906326  161.17692142  165.6260849   170.08821241]
198,絢香,Ayaka_1218,0.772059,200,"[u'\u7d62\u9999', u'\u304d\u3083\u308a\u30fc\u3071\u307f\u3085\u3071\u307f\u3085', u'Sky Ferreira', u'Crystal Castles', u'Led Zeppelin']",[   0.          116.90166808  126.05950976  132.54810448  134.05595847]
199,AFI,AFI,0.771745,200,"[u'AFI', u'System of a Down', u'Eminem', u'Arcade Fire', u'The Strypes']",[   0.          159.20113065  159.78110026  159.94686618  164.28024836]
200,Hunter Hayes,HunterHayes,0.771574,200,"[u'Hunter Hayes', u'Katie Melua', u'Carrie Underwood', u'The Killers', u'Metronomy']",[   0.          185.22418849  185.58825394  187.1977564   188.09306207]
201,Trivium,TriviumOfficial,0.771485,200,"[u'Trivium', u'Bloc Party', u'The Kooks', u'Lana Del Rey', u'Marilyn Manson']",[   0.          130.59479316  134.2944526   136.08453255  137.23337786]
202,Tamar Braxton,TamarBraxtonHer,0.771312,199,"[u'Tamar Braxton', u'Dillon Francis', u'Lorde', u'Eliza Doolittle', u'Craig Campbell']",[   0.          185.09457042  185.24578268  185.58017135  186.98663054]
203,Eros Ramazzotti,RamazzottiEros,0.771296,197,"[u'Eros Ramazzotti', u'Emis Killa', u'\u7d62\u9999', u'Gucci Mane', u'Sky Ferreira']",[   0.          264.84901359  269.89812893  271.04058737  276.68754941]
204,DJ Khaled,djkhaled,0.771278,200,"[u'DJ Khaled', u'Flume', u'Lana Del Rey', u'Iggy Azalea', u'Wiz Khalifa']",[   0.          125.1359261   129.11235417  132.04544672  134.47676379]
205,Joe Nichols,JoeNichols,0.770967,199,"[u'Joe Nichols', u'All Time Low', u'Daughtry', u'Guy Sebastian', u'Sara Bareilles']",[   0.          174.41903566  175.71567944  179.91664737  180.84247289]
206,Dvbbs,DVBBS,0.770844,200,"[u'Dvbbs', u'Lorde', u'Gabrielle Aplin', u'Lucy Rose', u'Alex Clare']",[   0.          154.88705562  155.49919614  156.09612423  160.62378404]
207,Fettes Brot,fettesbrot,0.770724,200,"[u'Fettes Brot', u'Marteria', u'Lana Del Rey', u'\u304d\u3083\u308a\u30fc\u3071\u307f\u3085\u3071\u307f\u3085', u'Andrea Berg']",[   0.          174.97714136  195.02820309  195.34328757  199.08289731]
208,System of a Down,systemofadown,0.770293,135,"[u'System of a Down', u'Vampire Weekend', u'Arcade Fire', u'Crystal Fighters', u'Agnes Obel']",[   0.          127.3106437   147.86480311  152.9803909   154.08114745]
209,Flume,flumemusic,0.769729,200,"[u'Flume', u'Iggy Azalea', u'JoJo', u'Marina and The Diamonds', u'Inna']",[  0.          87.50428561  88.10221337  89.1627725   89.29165695]
210,Keane,keaneofficial,0.76965,200,"[u'Keane', u'The Strypes', u'John Legend', u'Coldplay', u'Kodaline']",[   0.          189.79989463  193.43991315  193.57427515  193.88398593]
211,The Avett Brothers,theavettbros,0.769437,199,"[u'The Avett Brothers', u'The Strypes', u'Yann Tiersen', u'Tegan and Sara', u'Kodaline']",[   0.          145.12408484  145.56785359  147.16317474  147.26167186]
212,Carlos Vives,carlosvives,0.769207,200,"[u'Carlos Vives', u'Iv\xe1n Ferreiro', u'La Oreja de Van Gogh', u'Sergio Contreras', u'Dani Mart\xedn']",[   0.          186.37059854  206.91302521  208.37946156  214.96278748]
213,Foster the People,fosterthepeople,0.768617,191,"[u'Foster the People', u'All Time Low', u'Lorde', u'Lucy Spraggan', u'Alex Clare']",[   0.          111.91961401  115.97413505  117.94066305  119.18892566]
214,Miguel,MiguelUnlimited,0.768094,200,"[u'Miguel', u'Lorde', u'Gabrielle Aplin', u'Lucy Rose', u'Sia']",[   0.          116.8973909   120.18735374  121.27242061  123.36936411]
215,Sky Ferreira,skyferreira,0.767619,195,"[u'Sky Ferreira', u'Marina and The Diamonds', u'Skrillex', u'Nicky Romero', u'Emeli Sande']",[   0.           95.57719393   95.91663047  100.92571526  103.36343648]
216,Don Omar,DONOMAR,0.767318,200,"[u'Don Omar', u'Dani Mart\xedn', u'Iv\xe1n Ferreiro', u'Sergio Contreras', u'Juan Magan']",[   0.          244.3869882   244.6671208   251.51540708  254.19677417]
217,Lee Brice,leebrice,0.765925,200,"[u'Lee Brice', u'Rudimental', u'Eli Young Band', u'Demi Lovato', u'Mariah Carey']",[   0.          170.7776332   170.88007491  170.91810905  172.06103568]
218,Mariah Carey,MariahCarey,0.765634,200,"[u'Mariah Carey', u'Jason Mraz', u'David Guetta', u'Rihanna', u'The Kooks']",[   0.          115.23020437  122.51122398  123.68912644  124.31009613]
219,Reik,ReikMx,0.765304,200,"[u'Reik', u'Noel Torres', u'Alejandro Fern\xe1ndez', u'Alejandro Sanz', u'David Bisbal']",[   0.          120.44085686  124.63546847  126.60963628  129.30197214]
220,Motörhead,myMotorhead,0.765201,200,"[u'Mot\xf6rhead', u'Demi Lovato', u'Mariah Carey', u'Zendaya', u'Metronomy']",[   0.          177.81451009  181.15739013  181.2429309   183.31393837]
221,Emmanuel Moire,EmoireOff,0.764528,200,"[u'Emmanuel Moire', u'Joyce Jonathan', u'\u304d\u3083\u308a\u30fc\u3071\u307f\u3085\u3071\u307f\u3085', u'Ricky Martin', u'Inna']",[   0.          152.42375143  176.05112894  184.52642087  190.48097018]
222,You Me At Six,youmeatsix,0.764453,199,"[u'You Me At Six', u'Kodaline', u'Editors', u'The Strypes', u'Cut Copy']",[   0.          127.97265333  128.52237159  132.26488574  133.7161172 ]
223,Kaskade,kaskade,0.76384,200,"[u'Kaskade', u'Foster the People', u'All Time Low', u'Metronomy', u'Lorde']",[   0.          144.83784036  145.26527458  146.          147.87156589]
224,Cut Copy,cutcopy,0.763511,200,"[u'Cut Copy', u'The Strypes', u'Rise Against', u'Bloc Party', u'Crystal Fighters']",[   0.          127.54607011  128.37445229  129.305839    131.08012817]
225,Hardwell,HARDWELL,0.763354,200,"[u'Hardwell', u'Carly Rae Jepsen', u'David Guetta', u'Flume', u'Christina Perri']",[   0.          136.80277775  137.96376336  138.52436609  141.78504858]
226,Atif Aslam,itsaadee,0.763296,51,"[u'Atif Aslam', u'Sleigh Bells', u'Nicolas Jaar', u'Sevyn Streeter', u'Modest Mouse']",[  0.          57.97413216  61.49796745  66.9178601   70.34202158]
227,The Head and the Heart,headandtheheart,0.763078,197,"[u'The Head and the Heart', u'All Time Low', u'Metronomy', u'Foster the People', u'David Nail']",[   0.          130.70195102  134.62169216  137.77155004  138.426876  ]
228,Dream Theater,dreamtheaternet,0.763021,200,"[u'Dream Theater', u'Robbie Williams', u'Bob Marley', u'Massive Attack', u'Rush']",[   0.          234.57195058  246.19301371  247.28930426  247.3256962 ]
229,Goo Goo Dolls,googoodolls,0.762983,199,"[u'Goo Goo Dolls', u'Jason Mraz', u'Mumford and Sons', u'fun.', u'The Strypes']",[   0.          140.7586587   145.80809305  148.70104236  148.78171931]
230,Ke$ha,keshasuxx,0.762521,200,"[u'Ke$ha', u'JoJo', u'Marina and The Diamonds', u'Inna', u'Iggy Azalea']",[   0.          104.78549518  106.69582935  108.76120632  109.21996155]
231,Willie Nelson,willienelson,0.762332,200,"[u'Willie Nelson', u'Mumford and Sons', u'Editors', u'Blur', u'fun.']",[   0.          214.29419031  227.71912524  228.59133842  229.46023621]
232,Toby Keith,TobyKeithMusic,0.76163,197,"[u'Toby Keith', u'Justin Bieber', u'Demi Lovato', u'Zendaya', u'All Time Low']",[   0.          208.54975426  209.6926322   209.86662431  212.33699631]
233,Ms Mr,msmrsounds,0.760627,200,"[u'Ms Mr', u'OneRepublic', u'All Time Low', u'Family of the Year', u'Bonobo']",[   0.          114.32847414  125.13193038  126.84242193  128.24195881]
234,Amy Winehouse,amywinehouse,0.760555,145,"[u'Amy Winehouse', u'System of a Down', u'Agnes Obel', u'John Legend', u'Vampire Weekend']",[   0.          179.17031004  183.109257    183.80968418  184.30409654]
235,Booka Shade,BookaShade,0.760102,198,"[u'Booka Shade', u'fun.', u'Bon Iver', u'Nine Inch Nails', u'The Cranberries']",[   0.          142.38679714  144.48183277  147.62791064  152.93135715]
236,Andrea Bocelli,bocelliandrea,0.759782,200,"[u'Andrea Bocelli', u'Selena Gomez', u'Trina', u'Tame Impala', u'Akon']",[   0.          181.06076328  183.80696396  188.65842149  189.21416437]
237,A.R. Rahman,arrahman,0.759491,200,"[u'A.R. Rahman', u'Jason Mraz', u'Mariah Carey', u'Sara Evans', u'John Legend']",[   0.          111.66019882  129.97692103  132.09844814  133.79835574]
238,Eli Young Band,EliYoungBand,0.759131,199,"[u'Eli Young Band', u'Crystal Fighters', u'Rudimental', u'Daughtry', u'The Neighbourhood']",[   0.          135.77186748  138.03260484  138.30762813  138.84163641]
239,Train,train,0.758638,200,"[u'Train', u'Jason Mraz', u'A.R. Rahman', u'Fitz & The Tantrums', u'Robin Thicke']",[   0.          135.22203962  145.63310063  150.0833102   151.3406753 ]
240,Joyce Jonathan,joycejonathan,0.758248,200,"[u'Joyce Jonathan', u'Emmanuel Moire', u'Reik', u'Ricky Martin', u'\u304d\u3083\u308a\u30fc\u3071\u307f\u3085\u3071\u307f\u3085']",[   0.          152.42375143  232.93132035  233.2187814   235.23817717]
241,Gerardo Ortiz,gerardoortiznet,0.758131,200,"[u'Gerardo Ortiz', u'Trina', u'Noel Torres', u'The 1975', u'Selena Gomez']",[   0.          151.95394039  159.33298466  159.47413583  159.99374988]
242,B.o.B,bobatl,0.758025,200,"[u'B.o.B', u'JoJo', u'Iggy Azalea', u'A Day to Remember', u'Flume']",[   0.          139.3269536   140.10353315  144.66858678  144.81022063]
243,Gorillaz,gorillazband,0.757799,199,"[u'Gorillaz', u'Eminem', u'The Strypes', u'John Legend', u'Jason Mraz']",[   0.          168.01190434  168.02975927  169.63195454  169.75570683]
244,K. Michelle,kmichelle,0.757628,199,"[u'K. Michelle', u'Demi Lovato', u'The Kooks', u'Zendaya', u'Chris Brown']",[   0.          190.7065809   195.60163598  196.8603566   197.6208491 ]
245,Thalia,thalia,0.757595,198,"[u'Thalia', u'Babas\xf3nicos', u'Noel Torres', u'Gerardo Ortiz', u'Aventura']",[   0.          230.23249119  230.52331769  233.3195234   235.12975141]
246,Michel Teló,micheltelo,0.757261,200,"[u'Michel Tel\xf3', u'Pitty', u'Crystal Castles', u'Sevyn Streeter', u'Sleigh Bells']",[   0.          150.0833102   152.75470533  156.62375299  158.0316424 ]
247,Backstreet Boys,backstreetboys,0.757223,198,"[u'Backstreet Boys', u'Gabrielle Aplin', u'Bruno Mars', u'Natalie Grant', u'All Time Low']",[   0.          127.61661334  127.63228432  131.57127346  132.33291352]
248,Grouplove,GROUPLOVE,0.756755,200,"[u'Grouplove', u'Daughtry', u'All Time Low', u'The Naked And Famous', u'Sara Bareilles']",[   0.          130.8166656   132.05680596  133.6001497   133.75724279]
249,Alter Bridge,alterbridge,0.756586,199,"[u'Alter Bridge', u'Karmin', u'David Nail', u'Lorde', u'Lucy Rose']",[   0.          195.55050499  199.31633149  199.69476708  201.509305  ]
250,Danny Brown,XDannyXBrownX,0.756213,199,"[u'Danny Brown', u'Zendaya', u'Chris Brown', u'Nicki Minaj', u'Demi Lovato']",[   0.          188.92061825  189.97105043  190.76163136  191.03402838]
251,Tito El Bambino,Tbambino,0.755841,200,"[u'Tito El Bambino', u'Reik', u'Noel Torres', u'Alejandro Sanz', u'Espinoza Paz']",[   0.          172.77731333  173.1473361   174.8313473   176.83042725]
252,Jesse & Joy,jesseyjoy,0.755811,200,"[u'Jesse & Joy', u'Iv\xe1n Ferreiro', u'Pablo Alboran', u'Reik', u'Dani Mart\xedn']",[   0.          208.29306277  222.43650779  225.89156691  229.44062413]
253,Motel,motelmx,0.755632,200,"[u'Motel', u'Dani Mart\xedn', u'Reik', u'Marco Antonio Sol\xeds', u'David Bisbal']",[   0.          157.17506164  158.3414033   167.17057157  167.54999254]
254,Asking Alexandria,AfuckingA,0.755371,200,"[u'Asking Alexandria', u'Mayday Parade', u'Halestorm', u'Tegan and Sara', u'The Avett Brothers']",[   0.          150.74150059  151.16877985  153.74329254  154.73202642]
255,Lucy Spraggan,lspraggan,0.755109,200,"[u'Lucy Spraggan', u'Gabrielle Aplin', u'Eliza Doolittle', u'Natalie Grant', u'All Time Low']",[   0.          102.60604271  108.90362712  109.15585188  110.52601504]
256,Martin Solveig,martinsolveig,0.754421,200,"[u'Martin Solveig', u'Dillon Francis', u'Emeli Sande', u'Gabrielle Aplin', u'Marina and The Diamonds']",[   0.          101.75460678  107.93979804  108.65541864  108.75660899]
257,Black Sabbath,OfficialSabbath,0.754211,200,"[u'Black Sabbath', u'fun.', u'Tame Impala', u'blink-182', u'Robbie Williams']",[   0.          151.03972987  163.5909533   164.67240206  166.31596436]
258,Tame Impala,tameimpala,0.753959,200,"[u'Tame Impala', u'Selena Gomez', u'James Blake', u'Massive Attack', u'Trina']",[   0.          102.92230079  109.29318368  109.60383205  110.15897603]
259,Bon Iver,boniver,0.75365,200,"[u'Bon Iver', u'fun.', u'Nine Inch Nails', u'The Lumineers', u'Rise Against']",[   0.          126.96850003  134.21996871  135.76818479  135.90069904]
260,Eduardo Costa,eduardocosta,0.753356,200,"[u'Eduardo Costa', u'Pitty', u'Munhoz & Mariano', u'Natiruts', u'\u7d62\u9999']",[   0.          197.30686759  197.5879551   209.05740838  209.89521195]
261,All Time Low,AlexAllTimeLow,0.752875,200,"[u'All Time Low', u'Guy Sebastian', u'Metronomy', u'Goldfrapp', u'Tom Odell']",[   0.           95.96874491  102.96601381  104.64702576  105.01428474]
262,Asha Bhosle,ashabhosle,0.752429,199,"[u'Asha Bhosle', u'Duke Dumont', u'Sia', u'Boy George', u'Krewella']",[   0.          112.43220179  112.73420067  112.89818422  113.18568814]
263,Pet Shop Boys,petshopboys,0.752083,200,"[u'Pet Shop Boys', u'Train', u'Halestorm', u'Empire of the Sun', u'Maroon 5']",[   0.          193.98453547  200.58663963  201.41499448  204.85604702]
