,artist,screen_name,hotttnesss,num_tweets,recommendations,scores
395,Matt Redman,matt_redman,0.720754,200,"[u'Matt Redman', u'A.R. Rahman', u'Chris Tomlin', u'Katie Melua', u'John Legend']",[   0.          156.02243428  156.70354176  157.18778579  160.19051158]
396,Gramatik,Gramatik,0.720698,199,"[u'Gramatik', u'All Time Low', u'Metronomy', u'Guy Sebastian', u'Tom Odell']",[   0.          105.17128886  117.5627492   118.12281744  118.73921004]
397,Los Campesinos!,loscampesinos,0.720602,200,"[u'Los Campesinos!', u'Guy Sebastian', u'Hilltop Hoods', u'All Time Low', u'Ed Sheeran']",[   0.          123.00406497  123.23960402  123.40178281  123.50708482]
398,Joris Voorn,jorisvoorn,0.720094,200,"[u'Joris Voorn', u'Chris Brown', u'The Kooks', u'Lana Del Rey', u'Mariah Carey']",[   0.          145.16197849  148.27676824  148.70776711  149.00671126]
399,Jimmy Buffett,jimmybuffett,0.719905,200,"[u'Jimmy Buffett', u'Mumford and Sons', u'Kings of Leon', u'fun.', u'Aerosmith']",[   0.          220.00227272  225.04221826  225.19103002  229.84560035]
400,No te va Gustar,ntvgoficial,0.719796,199,"[u'No te va Gustar', u'Babas\xf3nicos', u'Banda El Recodo', u'Banda Los Recoditos', u'Reik']",[   0.          199.62715246  201.62341134  202.46234218  215.12554474]
401,John Fogerty,John_Fogerty,0.718912,200,"[u'John Fogerty', u'Mumford and Sons', u'Goo Goo Dolls', u'Alan Jackson', u'Jason Mraz']",[   0.          183.36848148  186.95453993  190.47572024  192.04426573]
402,Eliza Doolittle,elizadoolittle,0.71874,199,"[u'Eliza Doolittle', u'Lucy Spraggan', u'Sia', u'Kelly Clarkson', u'Lorde']",[   0.          108.90362712  108.96329657  110.39474625  110.571244  ]
403,Yeah Yeah Yeahs,YYYs,0.718191,193,"[u'Yeah Yeah Yeahs', u'Meek Mill', u'Chris Brown', u'The Kooks', u'Fall Out Boy']",[   0.          188.06116026  193.04921652  194.64326343  197.11671669]
404,Victoria Justice,VictoriaJustice,0.718115,200,"[u'Victoria Justice', u'Natalie Grant', u'Kelly Clarkson', u'Ariana Grande', u'Cassadee Pope']",[   0.          117.61802583  121.75385004  122.27837094  123.5030364 ]
405,Trina,TRINArockstarr,0.717826,200,"[u'Trina', u'Selena Gomez', u'Lykke Li', u'The 1975', u'James Blake']",[   0.           70.24243732   90.11659115  102.77159141  109.69958979]
406,Nick Cave & The Bad Seeds,ncandtbs,0.717704,200,"[u'Nick Cave & The Bad Seeds', u'Mumford and Sons', u'Jason Mraz', u'A.R. Rahman', u'The Strypes']",[   0.          177.60630619  179.9972222   181.95878654  184.85670126]
407,Umek,UMEK_1605,0.717414,199,"[u'Umek', u'Marilyn Manson', u'David Guetta', u'Rise Against', u'Bloc Party']",[   0.          132.56319248  132.95487956  136.72966028  137.49545447]
408,Gloria Estefan,GloriaEstefan,0.716698,200,"[u'Gloria Estefan', u'Krewella', u'Amitabh Bachchan', u'Modest Mouse', u'Steve Angello']",[   0.           98.85848471  106.54107189  106.66770833  107.17275773]
409,Нюша,Nyusha_Nyusha,0.716463,199,"[u'\u041d\u044e\u0448\u0430', u'Dima Bilan', u'\u304d\u3083\u308a\u30fc\u3071\u307f\u3085\u3071\u307f\u3085', u'\u7d62\u9999', u'Sky Ferreira']",[   0.          154.51213545  154.67385041  160.71714283  164.63596205]
410,Slipknot,slipknot,0.716313,196,"[u'Slipknot', u'James Blake', u'Selena Gomez', u'Tame Impala', u'Akon']",[   0.          167.80643611  172.18884981  175.98295372  176.283862  ]
411,Blue,officialblue,0.716312,199,"[u'Blue', u'The Head and the Heart', u'P!nk', u'Naughty Boy', u'Justin Bieber']",[   0.          216.39316071  217.13129668  218.53375025  218.63897182]
412,Los Inquietos del Norte,inquietosapp,0.716116,200,"[u'Los Inquietos del Norte', u'Babas\xf3nicos', u'Noel Torres', u'Gerardo Ortiz', u'Reik']",[   0.          177.83700402  185.64482217  187.6086352   201.77710475]
413,João Neto e Frederico,JNeFoficial,0.716042,200,"[u'Jo\xe3o Neto e Frederico', u'Ivete Sangalo', u'Natiruts', u'Luan Santana', u'Eduardo Costa']",[   0.          205.78872661  208.41545048  211.74512981  216.04629134]
414,Amos Lee,amoslee,0.715664,200,"[u'Amos Lee', u'Mayday Parade', u'The Avett Brothers', u'The Lumineers', u'Empire of the Sun']",[   0.          189.26700716  189.9921051   193.78338422  194.20607612]
415,Samo,SAMOALLSTAR,0.715626,200,"[u'Samo', u'Dani Mart\xedn', u'Marco Antonio Sol\xeds', u'Reik', u'Alejandro Sanz']",[   0.          145.16542288  156.29139452  159.36436239  159.93436154]
416,Love Of Lesbian,loveoflesbian,0.715493,198,"[u'Love Of Lesbian', u'Reik', u'Noel Torres', u'David Bisbal', u'La Oreja de Van Gogh']",[   0.          174.00574703  188.33480825  192.78226059  193.9536027 ]
417,Imran Khan,Imrankhanworld,0.715328,195,"[u'Imran Khan', u'Lorde', u'DK', u'Karmin', u'Gucci Mane']",[   0.          233.85251763  238.75301045  239.43057449  240.50571719]
418,Tori Kelly,ToriKelly,0.715102,199,"[u'Tori Kelly', u'Bruno Mars', u'Emeli Sande', u'Gabrielle Aplin', u'Ariana Grande']",[   0.          110.83771921  114.68216949  115.78860048  115.80155439]
419,Journey,JourneyOfficial,0.715048,200,"[u'Journey', u'Big Daddy Weave', u'Mumford and Sons', u'Booka Shade', u'Meat Loaf']",[   0.          176.26116986  177.09601915  178.31713322  181.18774793]
420,Atlas Genius,atlasgenius,0.714915,200,"[u'Atlas Genius', u'The Avett Brothers', u'You Me At Six', u'Kodaline', u'Yann Tiersen']",[   0.          165.7618774   169.2158385   173.31185764  175.86074036]
421,Meat Loaf,RealMeatLoaf,0.714903,199,"[u'Meat Loaf', u'Big Daddy Weave', u'Train', u'Boy & Bear', u'Madcon']",[   0.          135.65765736  154.56390264  154.59948253  155.00645148]
422,Tommy Trash,djtommytrash,0.714431,200,"[u'Tommy Trash', u'Skrillex', u'Mac Miller', u'Mac DeMarco', u'Emeli Sande']",[   0.          137.3790377   139.10068296  139.38077342  140.00357138]
423,Sergio Contreras,Sergi0Contreras,0.714228,198,"[u'Sergio Contreras', u'La Oreja de Van Gogh', u'Dani Mart\xedn', u'Abel Pintos', u'Iv\xe1n Ferreiro']",[   0.          166.53828389  167.1257012   170.07057359  177.71325218]
424,Jaheim,officialjaheim,0.713463,199,"[u'Jaheim', u'Harry Connick, Jr.', u'Sia', u'Anna Kendrick', u'Guy Sebastian']",[   0.          139.77124168  145.86294937  146.88430822  149.02013287]
425,Randy Houser,RandyHouser,0.713273,199,"[u'Randy Houser', u'Craig Campbell', u'Mac Miller', u'Lucy Rose', u'Girls']",[   0.          106.7988764   111.36875684  113.97368117  114.15340556]
426,Gucci Mane,gucci1017,0.713146,193,"[u'Gucci Mane', u'Lorde', u'Sky Ferreira', u'DK', u'Girls']",[   0.          166.19265928  166.58031096  167.86899654  172.36879068]
427,Babyshambles,babyshamblesuk,0.71307,196,"[u'Babyshambles', u'The Kooks', u'Chris Brown', u'Bloc Party', u'Lana Del Rey']",[   0.          149.969997    155.84928617  158.31298115  159.70911057]
428,Newsboys,newsboys,0.712972,200,"[u'Newsboys', u'A.R. Rahman', u'Meat Loaf', u'Mumford and Sons', u'Jason Mraz']",[   0.          170.45233938  170.76592166  171.47302995  172.30786401]
429,Big Daddy Weave,bdwmusic,0.712968,200,"[u'Big Daddy Weave', u'Meat Loaf', u'Boy & Bear', u'Chris Tomlin', u'Train']",[   0.          135.65765736  143.61058457  158.53390804  162.07714213]
430,Crystal Fighters,crystalfighters,0.712933,200,"[u'Crystal Fighters', u'Vampire Weekend', u'CHVRCHES', u'Carly Rae Jepsen', u'Bloc Party']",[   0.          122.33151679  123.83052935  124.7677843   125.01199942]
431,Maya Jane Coles,mjcofficial,0.712531,189,"[u'Maya Jane Coles', u'John Legend', u'Sub Focus', u'Carly Rae Jepsen', u'Avicii']",[   0.          115.51623263  116.20240961  121.61414391  121.88519188]
432,Sigur Rós,sigurros,0.712371,200,"[u'Sigur R\xf3s', u'Tame Impala', u'Selena Gomez', u'James Blake', u'Korpiklaani']",[   0.          165.          167.08081877  167.80345646  170.36725037]
433,Alex Clare,alexanderclare,0.712197,200,"[u'Alex Clare', u'Lorde', u'Girls', u'Boy George', u'Sia']",[  0.          88.0113629   90.31611152  91.88035699  93.65361712]
434,The Who,TheWho,0.711664,198,"[u'The Who', u'The Kooks', u'Mariah Carey', u'The Strypes', u'Macklemore']",[   0.          169.25129246  169.65553336  172.0755648   172.20917513]
435,Luis Enrique,LuisEnrique,0.711295,200,"[u'Luis Enrique', u'Dani Mart\xedn', u'Reik', u'La Oreja de Van Gogh', u'Noel Torres']",[   0.          209.8285014   213.10091506  216.69333169  218.06879648]
436,The Kooks,thekooksmusic,0.711279,199,"[u'The Kooks', u'Bloc Party', u'Lana Del Rey', u'Flume', u'Rihanna']",[   0.          108.48963084  113.04866209  113.10614484  115.01304274]
437,Snow Patrol,SnowPatrolBand,0.711035,200,"[u'Snow Patrol', u'The Avett Brothers', u'Tegan and Sara', u'Empire of the Sun', u'Asking Alexandria']",[   0.          190.79570226  191.83326093  196.35172523  198.21957522]
438,Building 429,building429,0.710865,199,"[u'Building 429', u'Hawk Nelson', u'The Kooks', u'Sara Bareilles', u'Mary J. Blige']",[   0.          170.02352778  170.39659621  174.81418707  177.23712929]
439,Larry Hernandez,larryhernandez1,0.710738,200,"[u'Larry Hernandez', u'Sevyn Streeter', u'Crystal Castles', u'Sleigh Bells', u'Nicolas Jaar']",[   0.           98.86859967   98.97474425  101.14346247  103.24243314]
440,Rammstein,RSprachrohr,0.710718,86,"[u'Rammstein', u'Crystal Castles', u'Sleigh Bells', u'Sevyn Streeter', u'Nicolas Jaar']",[  0.          70.74602462  71.30918594  75.12655988  76.47221718]
441,The Cranberries,The_Cranberries,0.710692,199,"[u'The Cranberries', u'fun.', u'Bon Iver', u'Mumford and Sons', u'Arctic Monkeys']",[   0.          134.95184326  137.96738745  140.27116596  140.89357686]
442,Crystal Castles,CRYSTALCASTLESS,0.710411,37,"[u'Crystal Castles', u'Sevyn Streeter', u'Sleigh Bells', u'Nicolas Jaar', u'Rammstein']",[  0.          40.70626487  45.14421336  46.80811895  70.74602462]
443,Pitty,pittyleone,0.710329,200,"[u'Pitty', u'Munhoz & Mariano', u'Michel Tel\xf3', u'Larry Hernandez', u'Fiuk']",[   0.          138.32931721  150.0833102   150.64859774  159.75606405]
444,Dillon Francis,DILLONFRANCIS,0.709915,200,"[u'Dillon Francis', u'Lorde', u'Martin Solveig', u'Marina and The Diamonds', u'Emeli Sande']",[   0.          100.84641788  101.75460678  102.40117187  103.0291221 ]
445,Nightmares on Wax,nightmaresonwax,0.709892,200,"[u'Nightmares on Wax', u'Flume', u'The Kooks', u'Rizzle Kicks', u'Rudimental']",[   0.          159.48354147  159.58070059  160.57708429  161.91046909]
446,tobyMac,therealtobymac,0.709854,200,"[u'tobyMac', u'Sara Bareilles', u'Jason Mraz', u'John Legend', u'Mariah Carey']",[   0.          142.39030866  142.59382876  143.8784209   145.16542288]
447,Miranda Lambert,mirandalambert,0.709311,200,"[u'Miranda Lambert', u'Katie Melua', u'Carrie Underwood', u'Harry Connick, Jr.', u'All Time Low']",[   0.          131.97727077  135.48800685  135.80132547  136.94159339]
448,Beck,beck,0.70856,160,"[u'Beck', u'Vampire Weekend', u'Arcade Fire', u'Marilyn Manson', u'Eminem']",[   0.          185.98655865  187.24048707  190.25246385  191.9218591 ]
449,DON BROCO,DONBROCO,0.708464,200,"[u'DON BROCO', u'Daughtry', u'Chase & Status', u'Bastille', u'Kodaline']",[   0.          129.75746607  132.0795215   134.36889521  135.11106542]
450,Steve Angello,SteveAngello,0.708151,200,"[u'Steve Angello', u'Skrillex', u'Mac Miller', u'Modest Mouse', u'Mac DeMarco']",[  0.          76.15116545  76.79192666  79.73706792  80.96295449]
451,Munhoz & Mariano,munhoz_mariano,0.708044,200,"[u'Munhoz & Mariano', u'Pitty', u'Ivete Sangalo', u'Michel Tel\xf3', u'\u304d\u3083\u308a\u30fc\u3071\u307f\u3085\u3071\u307f\u3085']",[   0.          138.32931721  159.17914436  160.50545162  161.6879711 ]
452,Robbie Williams,robbiewilliams,0.707806,200,"[u'Robbie Williams', u'Massive Attack', u'Lou Reed', u'Tame Impala', u'Rush']",[   0.          133.69367973  147.30580437  151.48267228  153.23185048]
453,Cults,CultsCultsCults,0.707792,111,"[u'Cults', u'Skrillex', u'The Strokes', u'Modest Mouse', u'Nicky Romero']",[   0.           99.47864092  100.31450543  101.47413464  106.16967552]
454,Aventura,Aventura,0.707723,197,"[u'Aventura', u'Romeo Santos', u'Lana Del Rey', u'Ricky Martin', u'Meek Mill']",[   0.          154.05518492  194.1957775   197.00507608  197.84589963]
455,Natalie Grant,NatalieGrant,0.707707,200,"[u'Natalie Grant', u'Gabrielle Aplin', u'Cassadee Pope', u'Sia', u'Guy Sebastian']",[   0.          104.14893182  104.16813332  104.43179592  104.9142507 ]
456,"Harry Connick, Jr.",HarryConnickJR,0.707128,200,"[u'Harry Connick, Jr.', u'Ed Sheeran', u'Guy Sebastian', u'Cassadee Pope', u'All Time Low']",[   0.          111.0990549   114.07453704  117.2305421   117.27318534]
457,Gippy Grewal,igippygrewal,0.706811,197,"[u'Gippy Grewal', u'Gucci Mane', u'Earnest Pugh', u'Sky Ferreira', u'Karmin']",[   0.          267.47336316  270.07776658  270.3830616   271.79403967]
458,Leonel García,LeonelGOficial,0.706527,200,"[u'Leonel Garc\xeda', u'Roberto Tapia', u'Alejandro Fern\xe1ndez', u'Larry Hernandez', u'Vicente Fern\xe1ndez']",[   0.          146.51962326  150.65191668  151.78603361  154.51213545]
459,Seal,Seal,0.706327,200,"[u'Seal', u'Passion Pit', u'Anna Kendrick', u'Cassadee Pope', u'Blake Shelton']",[   0.          156.0416611   159.4678651   182.59791894  185.06755523]
460,Phil Wickham,philwickham,0.706243,200,"[u'Phil Wickham', u'John Legend', u'Sara Bareilles', u'Bastille', u'Katie Melua']",[   0.          147.12579651  152.          152.26949793  153.98376538]
461,Girls,GIRLSsf,0.706144,199,"[u'Girls', u'Mac Miller', u'Lorde', u'Alex Clare', u'Boy George']",[  0.          84.58132182  85.72630868  90.31611152  91.90756226]
462,James Morrison,JamesMorrisonOK,0.70597,200,"[u'James Morrison', u'Jason Mraz', u'The Strypes', u'Maya Jane Coles', u'Editors']",[   0.          173.99712641  176.21577682  178.36759795  178.73443988]
463,Labrinth,Labrinthda1st,0.704779,200,"[u'Labrinth', u'Gabrielle Aplin', u'Natalie Grant', u'Cassadee Pope', u'Bruno Mars']",[   0.          101.9411595   105.12373662  105.46089323  106.88311373]
464,Deitrick Haddon,DeitrickHaddon,0.704658,200,"[u'Deitrick Haddon', u'Lorde', u'David Nail', u'Girls', u'Foster the People']",[   0.          171.9854645   174.25842878  175.85221068  179.40735771]
465,Cedric Gervais,CedricGervais,0.704509,200,"[u'Cedric Gervais', u'Guy Sebastian', u'Marina and The Diamonds', u'Flume', u'Chase & Status']",[   0.          137.3062271   138.77679921  140.61649974  141.27632498]
466,Miami Horror,Miami_Horror,0.704454,200,"[u'Miami Horror', u'Of Monsters and Men', u'Boy & Bear', u'The Strypes', u'Rise Against']",[   0.          174.65966907  174.88281791  176.98305004  178.82673178]
467,Metronomy,metronomy,0.704223,200,"[u'Metronomy', u'All Time Low', u'Guy Sebastian', u'Moby', u'Tom Odell']",[   0.          102.96601381  110.90536506  111.94641575  112.92475371]
468,Amitabh Bachchan,SrBachchan,0.704088,200,"[u'Amitabh Bachchan', u'Krewella', u'Boy George', u'Sia', u'Mac Miller']",[  0.          88.46468222  90.71383577  92.79008568  99.90995946]
469,Sidewalk Prophets,swprophets,0.703995,200,"[u'Sidewalk Prophets', u'Guy Sebastian', u'Bastille', u'MGMT', u'All Time Low']",[   0.          120.20399328  125.19984026  126.0793401   126.68464785]
470,Sia,Sia,0.703918,199,"[u'Sia', u'Krewella', u'Boy George', u'Lorde', u'Amitabh Bachchan']",[  0.          80.79603951  85.07055895  85.46929273  92.79008568]
471,Eric Paslay,ericpaslay,0.703893,198,"[u'Eric Paslay', u'Robin Thicke', u'Eli Young Band', u'Jason Mraz', u'The Avett Brothers']",[   0.          179.22053454  180.56023926  183.50204359  184.2091203 ]
472,Lyfe Jennings,Lyfeonline419,0.703725,200,"[u'Lyfe Jennings', u'Lorde', u'Sean Kingston', u'David Nail', u'Foster the People']",[   0.          181.55439956  185.42923178  187.14432933  187.41398027]
473,Faith Hill,FaithHill,0.703035,200,"[u'Faith Hill', u'Tim McGraw', u'Katie Melua', u'John Legend', u'Metronomy']",[   0.          148.59004004  150.69505632  151.90786681  154.10386108]
474,Weezer,Weezer,0.702989,198,"[u'Weezer', u'The Avett Brothers', u'The Smashing Pumpkins', u'Gogol Bordello', u'Fall Out Boy']",[   0.          217.89676455  221.07917134  225.21323229  227.25976327]
475,Halestorm,Halestorm,0.702643,200,"[u'Halestorm', u'Asking Alexandria', u'The Lumineers', u'Bon Iver', u'Maroon 5']",[   0.          151.16877985  151.50907564  153.44705927  154.29517167]
476,Dixie Chicks,dixiechicks,0.702456,199,"[u'Dixie Chicks', u'Jason Mraz', u'Coldplay', u'John Legend', u'The Strypes']",[   0.          127.22421153  127.89839718  130.74402472  131.60927019]
477,Active Child,ActiveChild,0.702401,200,"[u'Active Child', u'All Time Low', u'Guy Sebastian', u'Tom Odell', u'Goldfrapp']",[   0.          113.40634903  113.84638773  114.93041373  118.75184209]
478,2Cellos,2CELLOS,0.702364,200,"[u'2Cellos', u'Tame Impala', u'Massive Attack', u'Korpiklaani', u'Selena Gomez']",[   0.          187.01336851  187.23514627  188.03723036  188.41178307]
479,Milk & Sugar,Milk_and_Sugar,0.70232,200,"[u'Milk & Sugar', u'Marilyn Manson', u'Korpiklaani', u'Rise Against', u'The Cranberries']",[   0.          158.59066807  161.10245187  165.74377816  168.2171216 ]
480,Carlos Rivera,_CarlosRivera,0.702069,200,"[u'Carlos Rivera', u'Iv\xe1n Ferreiro', u'Dani Mart\xedn', u'Pablo Alboran', u'Sergio Contreras']",[   0.          218.51086929  234.05127643  238.00210083  238.48899346]
481,Sean Kingston,SeanKingston,0.701741,199,"[u'Sean Kingston', u'Lorde', u'Ed Sheeran', u'All Time Low', u'Guy Sebastian']",[   0.          108.08330121  108.87607634  109.90905331  111.40017953]
482,Natiruts,natirutsoficial,0.701644,200,"[u'Natiruts', u'Ivete Sangalo', u'Grupo Bom Gosto', u'Ricky Martin', u'\u304d\u3083\u308a\u30fc\u3071\u307f\u3085\u3071\u307f\u3085']",[   0.          187.5259982   188.93385086  190.62266392  191.48629194]
483,The Fray,TheFray,0.701537,200,"[u'The Fray', u'Hilltop Hoods', u'Lucy Spraggan', u'Los Campesinos!', u'Labrinth']",[   0.          206.85502169  207.27517941  207.38611332  207.44878886]
484,Gogol Bordello,GogolBordello,0.701395,200,"[u'Gogol Bordello', u'The Strypes', u'CHVRCHES', u'Kodaline', u'The Kooks']",[   0.          141.42489173  142.83206923  143.00349646  143.41199392]
485,Korpiklaani,_korpiklaani,0.701186,200,"[u'Korpiklaani', u'Selena Gomez', u'Tame Impala', u'Trina', u'Massive Attack']",[   0.          111.61093136  113.34019587  123.42204017  124.47891388]
486,Yo Gotti,YoGottiKOM,0.701152,200,"[u'Yo Gotti', u'Meek Mill', u'Chris Brown', u'Lana Del Rey', u'The Kooks']",[   0.          170.04999265  172.9971098   177.33020047  179.13123681]
487,Bonobo,sibonobo,0.701082,200,"[u'Bonobo', u'MGMT', u'Duke Dumont', u'Lucy Rose', u'Emeli Sande']",[   0.           97.87236586  101.46427943  101.74477874  103.35859906]
488,Fiuk,Fiuk,0.700622,200,"[u'Fiuk', u'Pitty', u'Crystal Castles', u'Sevyn Streeter', u'Sleigh Bells']",[   0.          159.75606405  160.14056326  162.34531099  163.07360301]
489,Sleigh Bells,sleighbells,0.699855,23,"[u'Sleigh Bells', u'Nicolas Jaar', u'Sevyn Streeter', u'Crystal Castles', u'Atif Aslam']",[  0.          32.32645975  33.27160952  45.14421336  57.97413216]
490,Marco Antonio Solís,MarcoASolis,0.699546,200,"[u'Marco Antonio Sol\xeds', u'David Bisbal', u'Dani Mart\xedn', u'Alejandro Sanz', u'Reik']",[   0.          130.66369044  138.07968714  140.22125374  147.68209099]
491,Busta Rhymes,BustaRhymes,0.699512,200,"[u'Busta Rhymes', u'Nicki Minaj', u'Justin Bieber', u'Zendaya', u'Kendrick Lamar']",[   0.          243.99795081  248.0866784   249.20272872  250.53941806]
492,Poliça,thisispolica,0.699493,199,"[u'Poli\xe7a', u'All Time Low', u'Lucy Spraggan', u'Lorde', u'Foster the People']",[   0.          133.9141516   142.42541908  142.90906199  143.70455803]
493,Noel Torres,jnoeltorres,0.699388,200,"[u'Noel Torres', u'Reik', u'Espinoza Paz', u'Alejandro Fern\xe1ndez', u'Alejandro Sanz']",[   0.          120.44085686  135.95955281  138.82362911  141.92955999]
494,Medina,MedinaMusic,0.698972,200,"[u'Medina', u'Lana Del Rey', u'Trina', u'Flume', u'Lykke Li']",[   0.          132.93983602  140.42435686  140.56315307  141.68980203]
495,Madcon,madc0n,0.698966,198,"[u'Madcon', u'Jason Mraz', u'Sara Evans', u'Rise Against', u'A.R. Rahman']",[   0.          134.40238093  141.30109695  148.96643917  150.65855435]
496,Hilltop Hoods,hilltophoods,0.698935,200,"[u'Hilltop Hoods', u'MGMT', u'Guy Sebastian', u'Goldfrapp', u'Ed Sheeran']",[   0.           95.37819457   96.03124492  102.56217626  103.28601067]
497,Sara Evans,saraevansmusic,0.698735,199,"[u'Sara Evans', u'Jason Mraz', u'David Guetta', u'Ne-Yo', u'Akon']",[   0.          121.45781161  125.93252161  127.65187033  129.36769303]
498,Grupo Bom Gosto,grupo_bom_gosto,0.698198,200,"[u'Grupo Bom Gosto', u'Ivete Sangalo', u'Luan Santana', u'Capital Inicial', u'Munhoz & Mariano']",[   0.          171.71487996  172.36298907  174.66253176  183.07375563]
499,Vicente Fernández,_VicenteFdez,0.698136,134,"[u'Vicente Fern\xe1ndez', u'Alejandro Fern\xe1ndez', u'Roberto Tapia', u'Dani Mart\xedn', u'Reik']",[   0.          134.90737563  140.35668848  141.63332941  143.27595751]
500,Mac DeMarco,Msldemarco,0.698017,173,"[u'Mac DeMarco', u'Skrillex', u'Mac Miller', u'Modest Mouse', u'Steve Angello']",[  0.          74.33707016  78.39642849  78.93668349  80.96295449]
501,Lucy Rose,lucyrosemusic,0.697965,200,"[u'Lucy Rose', u'Girls', u'Gabrielle Aplin', u'Duke Dumont', u'Lorde']",[  0.          93.10746479  93.71232576  94.48280267  98.42763839]
502,Earnest Pugh,earnestpugh,0.697662,200,"[u'Earnest Pugh', u'Lorde', u'Girls', u'John Newman', u'Dillon Francis']",[   0.          145.15508947  151.15224113  151.3274595   152.44015219]
503,Daughtry,CHRIS_Daughtry,0.697531,200,"[u'Daughtry', u'Sara Bareilles', u'Carly Rae Jepsen', u'Mary J. Blige', u'Guy Sebastian']",[   0.          110.90536506  112.08925015  116.50321884  118.70973001]
504,Modest Mouse,modestmouseband,0.697463,49,"[u'Modest Mouse', u'Sleigh Bells', u'Nicolas Jaar', u'Sevyn Streeter', u'Atif Aslam']",[  0.          59.72436689  67.11184694  69.72804314  70.34202158]
505,Justice Crew,JusticeCrew,0.697354,200,"[u'Justice Crew', u'The Head and the Heart', u'All Time Low', u'Metronomy', u'Foster the People']",[   0.          198.40110887  198.77625613  202.6918844   202.93348664]
506,Foxes,iamfoxes,0.697262,200,"[u'Foxes', u'John Newman', u'Guy Sebastian', u'All Time Low', u'Marina and The Diamonds']",[   0.          115.65898149  118.62124599  118.7897302   119.36917525]
507,"Tyler, The Creator",fucktyler,0.69717,200,"[u'Tyler, The Creator', u'Christina Perri', u'Iggy Azalea', u'JoJo', u'Marina and The Diamonds']",[   0.          102.18610473  103.33924714  103.54709074  111.0495385 ]
508,Feed Me,feedme,0.697078,199,"[u'Feed Me', u'Guy Sebastian', u'All Time Low', u'Goldfrapp', u'Metronomy']",[   0.          106.315568    108.60478811  113.32254851  114.79111464]
509,Dima Bilan,BilanOfficial,0.69701,200,"[u'Dima Bilan', u'\u304d\u3083\u308a\u30fc\u3071\u307f\u3085\u3071\u307f\u3085', u'Lana Del Rey', u'Trina', u'The 1975']",[   0.          108.45275469  122.86171088  129.63410045  133.4503653 ]
510,Mc Fitti,mc_fitti,0.696848,200,"[u'Mc Fitti', u'Trina', u'Dima Bilan', u'The 1975', u'Selena Gomez']",[   0.          145.57128838  148.31048513  151.33076356  155.01935363]
511,Marina and The Diamonds,MarinasDiamonds,0.696756,199,"[u'Marina and The Diamonds', u'Emeli Sande', u'JoJo', u'MGMT', u'Skrillex']",[  0.          78.39005039  81.58431222  83.40863265  85.6095789 ]
512,Jethro Tull,jethrotull,0.696488,200,"[u'Jethro Tull', u'Mumford and Sons', u'Kings of Leon', u'Bob Marley', u'The Cranberries']",[   0.          212.71812335  216.00925906  220.9343794   221.96621365]
513,Hawk Nelson,hawknelson,0.696449,200,"[u'Hawk Nelson', u'MGMT', u'Guy Sebastian', u'The Weeknd', u'All Time Low']",[   0.          117.6137747   117.66902736  122.82100798  122.9146045 ]
514,Anoushka Shankar,ShankarAnoushka,0.696172,200,"[u'Anoushka Shankar', u'Mumford and Sons', u'Gotye', u'Booka Shade', u'Sara Evans']",[   0.          166.83524807  171.37969541  173.57995276  174.11777623]
515,Bloc Party,BlocParty,0.696066,200,"[u'Bloc Party', u'The Kooks', u'Lana Del Rey', u'Rise Against', u'Rihanna']",[   0.          108.48963084  110.75197515  112.53443917  112.57886125]
516,for King & Country,4kingandcountry,0.69602,200,"[u'for King & Country', u'Nickelback', u'Chase & Status', u'Metric', u'Goldfrapp']",[   0.          139.57077058  141.76036117  145.5335013   147.14278779]
517,Ludacris,Ludacris,0.695283,200,"[u'Ludacris', u'Selena Gomez', u'Lykke Li', u'Akon', u'Trina']",[   0.          105.42770034  110.41738993  111.97321108  117.58826472]
